,date,time,abstract,sentiment_score
211,2019-01-04,12:28:50+0000,The Chinese central bank’s move is intended to send a signal that Beijing is ready to stem a slowdown that has darkened the global outlook.,"{'neg': 0.0, 'neu': 0.898, 'pos': 0.102, 'compound': 0.3612}"
212,2019-01-04,21:34:30+0000,The scandal-plagued bank could go a long way to help federal employees who aren’t being paid during the shutdown. Why hasn’t it done more?,"{'neg': 0.0, 'neu': 0.891, 'pos': 0.109, 'compound': 0.4019}"
213,2019-01-05,10:00:05+0000,"Facing billions of dollars in damages, PG&E and other utilities want legislators to let them pass on the cost to homeowners through higher electricity rates.","{'neg': 0.107, 'neu': 0.846, 'pos': 0.048, 'compound': -0.3818}"
214,2019-01-04,16:35:29+0000,"Democrats far outpaced Republicans in this election cycle in small donations, mostly using a group called ActBlue. The G.O.P. has no equivalent.","{'neg': 0.099, 'neu': 0.901, 'pos': 0.0, 'compound': -0.296}"
215,2019-01-04,20:07:45+0000,People change gears for all sorts of reasons — they have no other option or they find something they love more. The successful ones are comfortable with the risk.,"{'neg': 0.111, 'neu': 0.592, 'pos': 0.298, 'compound': 0.8511}"
216,2019-01-02,20:39:58+0000,"Europe’s central bank took control of troubled Banca Carige, an unprecedented step to manage risk as Italy’s political and economic woes continue.","{'neg': 0.296, 'neu': 0.704, 'pos': 0.0, 'compound': -0.7906}"
217,2019-01-02,10:00:05+0000,Democrats will move quickly to try to build grass-roots support and raise money — two prerequisites for any candidate hoping to break out of what is likely to be a congested pack of contenders.,"{'neg': 0.0, 'neu': 0.845, 'pos': 0.155, 'compound': 0.6705}"
218,2019-01-02,11:24:11+0000,Wall Street’s top stock pickers are expecting gains this year. But those forecasts could be upended.,"{'neg': 0.0, 'neu': 0.769, 'pos': 0.231, 'compound': 0.4939}"
219,2019-03-13,23:29:08+0000,Hollywood stars were the headline figures facing charges. But other wealthy parents accused of seeking an edge for their children may have careers more easily ruined.,"{'neg': 0.227, 'neu': 0.62, 'pos': 0.153, 'compound': -0.3581}"
220,2019-03-13,10:46:20+0000,Federal prosecutors accused financial heavyweights like Bill McGlashan and Gordon Caplan of paying to get their kids into college through fraud.,"{'neg': 0.226, 'neu': 0.679, 'pos': 0.094, 'compound': -0.5423}"
221,2019-06-07,09:00:09+0000,Treasury Secretary Steven Mnuchin will meet China’s central bank governor in the first meeting of senior officials from the countries since trade talks broke down.,"{'neg': 0.101, 'neu': 0.833, 'pos': 0.065, 'compound': -0.25}"
222,2019-03-28,15:05:56+0000,"Efforts to raise money had failed, prompting the company to cease all flights on Thursday morning.","{'neg': 0.18, 'neu': 0.82, 'pos': 0.0, 'compound': -0.5106}"
223,2019-05-16,17:03:58+0000,"Craig Phillips, a former Wall Street executive who joined the Treasury Department to try to reshape the country’s mortgage market, will depart next month.","{'neg': 0.0, 'neu': 0.924, 'pos': 0.076, 'compound': 0.2023}"
224,2019-05-24,18:16:40+0000,An indictment in Brooklyn says a physician and a medical consultant were part of a network that enticed women to have surgery to bolster lawsuit settlements.,"{'neg': 0.079, 'neu': 0.921, 'pos': 0.0, 'compound': -0.2263}"
225,2019-04-12,07:41:43+0000,"The government said work on the East Coast Rail Link would resume after its price tag, originally projected at up to $20 billion, was cut nearly in half.","{'neg': 0.072, 'neu': 0.928, 'pos': 0.0, 'compound': -0.2732}"
226,2019-02-07,17:47:51+0000,"In an acknowledgment of possible wrongdoing by its former leader, the French carmaker suggested he might have misused company funds for a lavish event at Versailles.","{'neg': 0.0, 'neu': 1.0, 'pos': 0.0, 'compound': 0.0}"
227,2019-03-19,17:10:51+0000,"A potential merger between Deutsche Bank and Commerzbank is a private economic affair and the government should stay out of it, Chancellor Angela Merkel said.","{'neg': 0.0, 'neu': 1.0, 'pos': 0.0, 'compound': 0.0}"
228,2019-05-31,15:53:34+0000,"Price increases are slowing. There are more properties for sale. And mortgage rates are low. Still, much depends on what kind of house you want, and where.","{'neg': 0.074, 'neu': 0.88, 'pos': 0.046, 'compound': -0.2023}"
229,2019-03-27,22:19:59+0000,The oil company’s investment in Sabic will infuse money into a Saudi sovereign wealth fund after a planned initial public offering of Aramco faltered.,"{'neg': 0.0, 'neu': 0.868, 'pos': 0.132, 'compound': 0.4939}"
230,2019-06-21,18:02:22+0000,Gov. Gavin Newsom’s proposal would also protect power company customers from the kind of huge claims that have helped push Pacific Gas & Electric into bankruptcy.,"{'neg': 0.0, 'neu': 0.833, 'pos': 0.167, 'compound': 0.5584}"
231,2019-02-13,08:56:03+0000,The board’s vote comes as Mr. Ghosn hires a star lawyer in Japan to defend him against charges of financial wrongdoing.,"{'neg': 0.1, 'neu': 0.9, 'pos': 0.0, 'compound': -0.2732}"
232,2019-06-07,21:15:32+0000,"The value of fractional real estate has long been debated. Critics see it as a hustle, while supporters say it is a smarter way to use a vacation home.","{'neg': 0.068, 'neu': 0.677, 'pos': 0.255, 'compound': 0.7269}"
233,2019-01-23,17:14:31+0000,"Mr. Ghosn faces charges in Japan, and his departure will allow the French automaker to focus on mending ties with its longtime Japanese partner.","{'neg': 0.081, 'neu': 0.846, 'pos': 0.073, 'compound': -0.0516}"
234,2019-04-30,23:18:37+0000,"The company said it would add to its record returns to shareholders, most likely fueling an intensifying debate over corporate spending.","{'neg': 0.0, 'neu': 1.0, 'pos': 0.0, 'compound': 0.0}"
235,2019-03-08,13:56:30+0000,The proposal regarding the country’s $1 trillion of holdings could increase concerns among investors about the risks of owning such stocks.,"{'neg': 0.09, 'neu': 0.812, 'pos': 0.098, 'compound': 0.0516}"
236,2019-01-14,11:28:27+0000,"“Don’t tell me you don’t know where the money went,” the country’s finance minister said.","{'neg': 0.0, 'neu': 1.0, 'pos': 0.0, 'compound': 0.0}"
237,2019-06-28,02:27:33+0000,One of Ms. Gillibrand’s signature proposals calls for investing heavily in maternal and child health.,"{'neg': 0.0, 'neu': 1.0, 'pos': 0.0, 'compound': 0.0}"
238,2019-06-06,21:15:53+0000,Talks between Fiat Chrysler and Renault to create one of the world’s largest automakers ran into a familiar problem in France: the government itself.,"{'neg': 0.105, 'neu': 0.814, 'pos': 0.081, 'compound': -0.1531}"
239,2019-01-10,19:24:02+0000,The European Commission is investigating whether the Dutch government illegally allowed the American sportswear maker to camouflage profits and save billions in taxes.,"{'neg': 0.0, 'neu': 0.775, 'pos': 0.225, 'compound': 0.7269}"
240,2019-01-14,11:28:27+0000,"“Don’t tell me you don’t know where the money went,” the country’s finance minister said.","{'neg': 0.0, 'neu': 1.0, 'pos': 0.0, 'compound': 0.0}"
241,2019-01-10,19:20:47+0000,"At the economics profession’s largest annual gathering, women said sexual harassment, discrimination and bullying were pushing them to the sidelines or out of the field altogether.","{'neg': 0.236, 'neu': 0.764, 'pos': 0.0, 'compound': -0.8126}"
242,2019-04-22,18:17:23+0000,"Seeking to avoid conflict-of-interest concerns, the former vice president plans to shutter the Biden Foundation after joining the presidential campaign.","{'neg': 0.104, 'neu': 0.896, 'pos': 0.0, 'compound': -0.296}"
243,2019-06-03,19:05:38+0000,"With Renault’s board set to meet Tuesday to discuss a merger, France’s finance minister wants the government to have a seat on any new board, and Nissan spoke of a “fundamental review” of its current alliance.","{'neg': 0.0, 'neu': 1.0, 'pos': 0.0, 'compound': 0.0}"
244,2019-03-06,15:43:02+0000,Statistics on convictions indicate that the odds are against Mr. Ghosn in his trial.,"{'neg': 0.0, 'neu': 1.0, 'pos': 0.0, 'compound': 0.0}"
245,2019-03-01,17:00:58+0000,The ride-sharing company unveiled the prospectus for its initial public offering. It leads a wave of well-known tech start-ups that plan to go public this year.,"{'neg': 0.0, 'neu': 1.0, 'pos': 0.0, 'compound': 0.0}"
246,2019-02-22,00:19:09+0000,The on-demand delivery company aims to reach every ZIP code in America before its competitors.,"{'neg': 0.0, 'neu': 0.927, 'pos': 0.073, 'compound': 0.0258}"
247,2019-05-13,13:02:33+0000,"Beijing’s matched the Trump administration’s de facto delay in collecting the new tariffs, giving both sides breathing room to reach a deal.","{'neg': 0.097, 'neu': 0.756, 'pos': 0.147, 'compound': 0.0516}"
248,2019-04-30,13:58:04+0000,Berkshire Hathaway said it will buy preferred stock in Occidental Petroleum to help it upstage Chevron’s proposed acquisition of Anadarko.,"{'neg': 0.0, 'neu': 0.876, 'pos': 0.124, 'compound': 0.4019}"
249,2019-03-06,14:28:17+0000,"The president has railed against the trade deficit, but numbers from last year show that textbook economics caught up with some of his unorthodox economic policies.","{'neg': 0.069, 'neu': 0.931, 'pos': 0.0, 'compound': -0.2144}"
250,2019-03-06,14:28:17+0000,"The president has railed against the trade deficit, but numbers from last year show that textbook economics caught up with some of his unorthodox economic policies.","{'neg': 0.069, 'neu': 0.931, 'pos': 0.0, 'compound': -0.2144}"
251,2019-06-27,21:30:01+0000,"Mr. Bennet, a senator from Colorado, has called for a lifetime ban on members of Congress becoming lobbyists, and other measures meant to reboot American democracy.","{'neg': 0.135, 'neu': 0.865, 'pos': 0.0, 'compound': -0.5574}"
252,2019-02-06,08:00:04+0000,A new five-year policy offers $100 billion for infrastructure to stimulate growth — a shift from a focus on consumer spending.,"{'neg': 0.0, 'neu': 0.769, 'pos': 0.231, 'compound': 0.5423}"
253,2019-01-17,10:26:20+0000,The company said it could not come to financial terms for the nearly $20 billion endeavor with the British and Japanese governments.,"{'neg': 0.0, 'neu': 1.0, 'pos': 0.0, 'compound': 0.0}"
254,2019-03-06,05:49:15+0000,"After Uber sold its operations in the region to Grab last year, the company’s transport revenue doubled. Its food delivery revenue grew 45 times.","{'neg': 0.0, 'neu': 1.0, 'pos': 0.0, 'compound': 0.0}"
255,2019-04-08,23:01:47+0000,"Despite concerns about the company’s ties to Saudi Arabia and Crown Prince Mohammed bin Salman, Aramco is the world’s most profitable company, and investors want a piece of it.","{'neg': 0.0, 'neu': 0.853, 'pos': 0.147, 'compound': 0.5413}"
256,2019-03-03,20:14:33+0000,"As governments pull back on spending, companies are paying for private terminals, joining in renovations and even reopening an airport to commercial flights.","{'neg': 0.0, 'neu': 1.0, 'pos': 0.0, 'compound': 0.0}"
257,2019-06-23,07:02:04+0000,"When the 2020 Democrats were asked the best way to improve the health care system, a split in the field was revealed. Here are full responses from 19 candidates.","{'neg': 0.0, 'neu': 0.708, 'pos': 0.292, 'compound': 0.8834}"
258,2019-05-02,13:27:07+0000,"The plan, disclosed in a regulatory filing, comes after the carmaker announced a surprisingly sharp quarterly loss.","{'neg': 0.131, 'neu': 0.743, 'pos': 0.126, 'compound': -0.0258}"
259,2019-05-14,14:12:03+0000,"The deal is a potentially crucial deal for the home of “The Handmaid’s Tale,” which originally built its audience on shows from NBC, ABC and Fox.","{'neg': 0.0, 'neu': 1.0, 'pos': 0.0, 'compound': 0.0}"
260,2019-05-14,14:12:03+0000,"The deal is a potentially crucial deal for the home of “The Handmaid’s Tale,” which originally built its audience on shows from NBC, ABC and Fox.","{'neg': 0.0, 'neu': 1.0, 'pos': 0.0, 'compound': 0.0}"
261,2019-02-25,17:08:57+0000,"In selling the business, G.E. took another big step in what has become a drastic slimming-down of an American corporate icon.","{'neg': 0.0, 'neu': 1.0, 'pos': 0.0, 'compound': 0.0}"
262,2019-01-30,11:37:03+0000,"Beijing and Washington have reasons to seek progress in negotiations, but the sides are still far apart.","{'neg': 0.0, 'neu': 0.894, 'pos': 0.106, 'compound': 0.2263}"
263,2019-02-05,11:31:25+0000,"President Trump plans to nominate David Malpass, the under secretary of the Treasury for international affairs, to the role. It may prove contentious.","{'neg': 0.088, 'neu': 0.84, 'pos': 0.072, 'compound': -0.1027}"
264,2019-04-22,10:00:01+0000,The key question is whether the legislation she has proposed is the best means to police corporate leaders.,"{'neg': 0.0, 'neu': 0.802, 'pos': 0.198, 'compound': 0.6369}"
265,2019-03-17,13:50:06+0000,"The negotiations are aimed at creating a national champion to take on Wall Street giants, but it is unclear whether a deal would solve either companies’ problems.","{'neg': 0.187, 'neu': 0.619, 'pos': 0.193, 'compound': -0.2023}"
266,2019-01-11,05:11:01+0000,"President Trump traveled to the southern border to make his case for a wall, and Vice President Mike Pence shattered talk of a compromise with Democrats.","{'neg': 0.119, 'neu': 0.881, 'pos': 0.0, 'compound': -0.4767}"
267,2019-03-08,00:00:40+0000,China’s WeChat messaging app offers clues as to how Facebook may carry out its shift toward private messaging. But whether Facebook can pull the change off is another question.,"{'neg': 0.0, 'neu': 1.0, 'pos': 0.0, 'compound': 0.0}"
268,2019-01-09,19:56:41+0000,"Mr. Lasseter, who resigned from Disney in June after complaints about unwanted touching, will build Skydance Animation. One women’s advocacy group, Time’s Up, blasted the move.","{'neg': 0.223, 'neu': 0.777, 'pos': 0.0, 'compound': -0.6808}"
269,2019-06-10,17:17:03+0000,"Josh Tyrangiel is out after a four-year run. Jesse Angelo, the former publisher of The New York Post, is set to come aboard.","{'neg': 0.0, 'neu': 0.95, 'pos': 0.05, 'compound': 0.0258}"
270,2019-05-01,13:00:05+0000,"J. David Goodman, a metro reporter, has chronicled the Google and Amazon invasions. But the most effective technology for reporting on the city is still coffee.","{'neg': 0.0, 'neu': 0.819, 'pos': 0.181, 'compound': 0.624}"
271,2019-03-20,09:00:12+0000,"Investors have finally started to chase this year’s stock market rally, which has been driven largely by the Federal Reserve’s sharp turn away from steady rate increases.","{'neg': 0.0, 'neu': 1.0, 'pos': 0.0, 'compound': 0.0}"
272,2019-06-10,17:17:03+0000,"Josh Tyrangiel is out after a four-year run. Jesse Angelo, the former publisher of The New York Post, is set to come aboard.","{'neg': 0.0, 'neu': 0.95, 'pos': 0.05, 'compound': 0.0258}"
273,2019-01-23,11:54:02+0000,"Larry Kudlow, the head of the National Economic Council, denied a Financial Times report that the U.S. turned down China’s offer on trade talks.","{'neg': 0.116, 'neu': 0.884, 'pos': 0.0, 'compound': -0.4404}"
274,2019-05-14,10:01:50+0000,"Mr. Bullock, a little-known moderate from a lightly populated state, joins a field dominated by high-profile candidates from the two coasts.","{'neg': 0.0, 'neu': 1.0, 'pos': 0.0, 'compound': 0.0}"
275,2019-01-16,22:46:32+0000,"If the carmaker ousts Mr. Ghosn, who is jailed in Tokyo on charges of financial impropriety, he would be separated entirely from the auto empire he created.","{'neg': 0.169, 'neu': 0.767, 'pos': 0.064, 'compound': -0.5106}"
276,2019-06-13,19:18:50+0000,"In the newly unearthed video, in which Mr. Biden reaffirmed his support for Roe v. Wade, he said he believed abortions were “always a tragedy.”","{'neg': 0.0, 'neu': 0.895, 'pos': 0.105, 'compound': 0.4019}"
277,2019-03-22,18:14:21+0000,"When long-term interest rates fall below short-term rates, it’s called a yield curve inversion. It’s one of Wall Street’s favored predictors of a recession, and it happened on Friday.","{'neg': 0.086, 'neu': 0.736, 'pos': 0.178, 'compound': 0.4588}"
278,2019-03-21,16:00:05+0000,"The company, known for lending designer dresses for special occasions, says its goal is to “create the Amazon Prime of rental.”","{'neg': 0.0, 'neu': 0.812, 'pos': 0.188, 'compound': 0.5267}"
279,2019-06-13,17:38:54+0000,"Jess Ravich, one of the highest-ranking executives to be accused of sexual misconduct in the #MeToo era, left TCW, the giant bond-investment firm.","{'neg': 0.091, 'neu': 0.909, 'pos': 0.0, 'compound': -0.296}"
280,2019-01-28,11:47:00+0000,"With the next generation of digital networks about to remake the internet, the United States is pushing its allies to resist Huawei.","{'neg': 0.0, 'neu': 0.882, 'pos': 0.118, 'compound': 0.4215}"
281,2019-01-23,11:54:02+0000,"Larry Kudlow, the head of the National Economic Council, denied a Financial Times report that the U.S. turned down China’s offer on trade talks.","{'neg': 0.116, 'neu': 0.884, 'pos': 0.0, 'compound': -0.4404}"
282,2019-03-15,09:00:09+0000,"Pursuit, a nonprofit jobs training program in Queens, is finding success at moving low-income New Yorkers into well-paying jobs.","{'neg': 0.0, 'neu': 0.821, 'pos': 0.179, 'compound': 0.5719}"
283,2019-01-29,08:51:47+0000,"A move by California’s largest electric utility, anticipating billions of dollars in damage claims, leaves wildfire victims, ratepayers, investors, creditors and suppliers to battle over a plan.","{'neg': 0.269, 'neu': 0.731, 'pos': 0.0, 'compound': -0.7964}"
284,2019-05-15,05:39:09+0000,President Trump’s tariffs were initially seen as a method to force other countries to drop their trade barriers. But they increasingly look like a permanent tool.,"{'neg': 0.079, 'neu': 0.827, 'pos': 0.094, 'compound': 0.1027}"
285,2019-01-14,00:18:51+0000,Reports about the use of homegrown disinformation online in a 2017 Senate race suggest foreign operatives may be just one thing threatening the integrity of the next presidential election.,"{'neg': 0.106, 'neu': 0.812, 'pos': 0.081, 'compound': -0.2023}"
286,2019-04-04,02:29:43+0000,Amazon filed a motion saying the company was “justified in terminating its relationship with Allen.”,"{'neg': 0.0, 'neu': 0.884, 'pos': 0.116, 'compound': 0.1779}"
287,2019-02-26,22:09:54+0000,"The company failed to investigate claims of sexual misconduct against its founder, Nevada regulators said.","{'neg': 0.191, 'neu': 0.809, 'pos': 0.0, 'compound': -0.5106}"
288,2019-01-31,14:00:04+0000,"Senator Bernie Sanders introduced a plan lowering the threshold for taxing assets transferred to heirs, joining others in the party trying to address income inequality.","{'neg': 0.073, 'neu': 0.766, 'pos': 0.161, 'compound': 0.34}"
289,2019-03-14,15:04:24+0000,"White-collar workers face job cuts and shrinking paychecks even in go-go industries like technology, suggesting the economic pain is broader than official figures show.","{'neg': 0.19, 'neu': 0.724, 'pos': 0.086, 'compound': -0.4588}"
290,2019-01-07,16:23:50+0000,A nuclear power facility proposed for a rugged coastline stretch could lift the local economy while expanding Britain’s non-carbon fuel options.,"{'neg': 0.0, 'neu': 1.0, 'pos': 0.0, 'compound': 0.0}"
291,2019-06-05,07:00:04+0000,"Despite its huge debt, the country remains an economic powerhouse. Some say it provides a model for the United States, but its leaders disavow the idea.","{'neg': 0.055, 'neu': 0.817, 'pos': 0.128, 'compound': 0.2439}"
292,2019-02-04,17:08:34+0000,The newspaper publisher’s board said the $1.3 billion offer “is not in the best interests of Gannett and its shareholders.” But the fight for control is likely to go on.,"{'neg': 0.171, 'neu': 0.772, 'pos': 0.057, 'compound': -0.6083}"
293,2019-02-28,21:28:52+0000,"With the primary race already historically crowded, some analysts say the old rules about when to announce no longer matter.","{'neg': 0.103, 'neu': 0.845, 'pos': 0.052, 'compound': -0.2732}"
294,2019-05-03,17:27:57+0000,"In their lawsuit, the drivers accuse the ride-hailing giant of operating illegally in the country and of destroying their livelihoods. Uber denied the allegations.","{'neg': 0.334, 'neu': 0.605, 'pos': 0.061, 'compound': -0.8221}"
295,2019-01-31,18:05:37+0000,Robert Swan takes the helm at a time when the Silicon Valley company is financially strong but facing questions about its future.,"{'neg': 0.0, 'neu': 0.903, 'pos': 0.097, 'compound': 0.2846}"
296,2019-05-13,21:29:50+0000,Entrepreneurs are taking up the search for a near limitless energy source and seeking investors willing to put money behind a long-shot bet against climate change.,"{'neg': 0.0, 'neu': 0.916, 'pos': 0.084, 'compound': 0.2732}"
297,2019-05-22,11:00:06+0000,Ms. Gillibrand’s campaign introduced a plan that would help new families with everything from diapers and nursery beds to paid leave and prekindergarten.,"{'neg': 0.05, 'neu': 0.837, 'pos': 0.113, 'compound': 0.3612}"
298,2019-01-25,23:46:59+0000,The indictment of Natalia V. Veselnitskaya raises a question: Why would prosecutors pursue a case in which there is little likelihood of getting the defendant to the United States?,"{'neg': 0.0, 'neu': 0.903, 'pos': 0.097, 'compound': 0.4215}"
299,2019-01-10,12:12:36+0000,"Lu Shaye said in an op-ed for The Hill Times that Canadians applied “double standards,” viewing their own country’s laws as having to be observed, but not China’s.","{'neg': 0.0, 'neu': 1.0, 'pos': 0.0, 'compound': 0.0}"
300,2019-05-08,20:42:25+0000,"Web-focused companies are increasingly competing with traditional brokerages, moving to displace agents from the process of selling a house, and now the other side.","{'neg': 0.0, 'neu': 1.0, 'pos': 0.0, 'compound': 0.0}"
301,2019-05-19,19:20:16+0000,The great hope for people without a bachelor’s degree hasn’t yet spread beyond small-scale success stories.,"{'neg': 0.0, 'neu': 0.529, 'pos': 0.471, 'compound': 0.8934}"
302,2019-04-11,19:46:25+0000,President Andrés Manuel López Obrador wants to limit private and foreign investment while strengthening state-owned giants that analysts say are inefficient and corrupt.,"{'neg': 0.0, 'neu': 0.873, 'pos': 0.127, 'compound': 0.4939}"
303,2019-04-30,22:12:21+0000,Negotiations appear to have done little to resolve an emerging rivalry over data that the tech industry says is key to industries of the future.,"{'neg': 0.0, 'neu': 0.912, 'pos': 0.088, 'compound': 0.323}"
304,2019-02-10,19:58:13+0000,"CB Insights, a firm that tracks start-ups, analyzed a variety of data to create a list of 50 private companies around the world that are on a path to a $1 billion valuation.","{'neg': 0.0, 'neu': 0.928, 'pos': 0.072, 'compound': 0.2732}"
305,2019-01-24,14:00:06+0000,"With funding from a surprising source, Volkswagen, California is making sure low-income communities have the chance to gain access to electric vehicles.","{'neg': 0.0, 'neu': 0.634, 'pos': 0.366, 'compound': 0.8316}"
306,2019-03-11,17:13:26+0000,"Turkish government figures show two consecutive quarters of declining growth amid falling investor confidence, shrinking investment and rising prices.","{'neg': 0.068, 'neu': 0.681, 'pos': 0.251, 'compound': 0.6486}"
307,2019-02-22,08:00:04+0000,"Amazon may not call it home. But the city, by design and because of its allure, is increasingly a magnet for coders and companies.","{'neg': 0.0, 'neu': 0.928, 'pos': 0.072, 'compound': 0.1779}"
308,2019-06-20,16:45:29+0000,"Business titans who have prospered in the global financial center feared the wrath of China. They spoke out only after Beijing wavered. China’s rise has enriched, and intimidated, them.","{'neg': 0.184, 'neu': 0.816, 'pos': 0.0, 'compound': -0.7269}"
309,2019-05-28,15:14:56+0000,The electric-truck venture hailed by President Trump exists almost entirely on paper and would need $300 million to get the factory running again.,"{'neg': 0.0, 'neu': 0.921, 'pos': 0.079, 'compound': 0.2263}"
310,2019-05-28,15:14:56+0000,The electric-truck venture hailed by President Trump exists almost entirely on paper and would need $300 million to get the factory running again.,"{'neg': 0.0, 'neu': 0.921, 'pos': 0.079, 'compound': 0.2263}"
311,2019-01-11,10:42:19+0000,"A Polish citizen who works for the French telecommunications company Orange was also charged, officials said.","{'neg': 0.114, 'neu': 0.886, 'pos': 0.0, 'compound': -0.2023}"
312,2019-03-21,16:29:44+0000,"Polling shows those getting smaller refunds are less likely to view the tax overhaul favorably, even if their take-home pay grew.","{'neg': 0.061, 'neu': 0.826, 'pos': 0.113, 'compound': 0.296}"
313,2019-02-22,15:33:17+0000,"Despite talk that the dollar was losing dominance, it has only gained stature, reinforcing President Trump’s power to dictate foreign policy.","{'neg': 0.104, 'neu': 0.72, 'pos': 0.176, 'compound': 0.2023}"
314,2019-05-14,11:19:51+0000,"Mr. Bullock, the latest Democrat to announce his presidential campaign, was twice elected governor of deep-red Montana. But his policies aren’t all centrist.","{'neg': 0.0, 'neu': 1.0, 'pos': 0.0, 'compound': 0.0}"
315,2019-05-07,09:00:13+0000,"Offering “instant buying” to home sellers, companies like Zillow and Opendoor are bringing liquidity to the housing market. Critics fear they will also bring risk.","{'neg': 0.242, 'neu': 0.677, 'pos': 0.081, 'compound': -0.6124}"
316,2019-06-20,14:00:52+0000,"The Japanese carmaker will have Renault’s backing to fix governance lapses, in a deal made before a key shareholder meeting.","{'neg': 0.0, 'neu': 0.939, 'pos': 0.061, 'compound': 0.0258}"
317,2019-05-16,09:00:16+0000,"As Prime Minister Narendra Modi seeks re-election, he confronts anger over a weakening economy and failed promises to revive stalled infrastructure projects.","{'neg': 0.406, 'neu': 0.438, 'pos': 0.156, 'compound': -0.7906}"
