,date,time,abstract,sentiment_score
426,2019-02-22,21:36:12+0000,"President Trump said there was a “very, very good chance” of a trade deal with China being reached when he meets with the Chinese president in March.","{'neg': 0.0, 'neu': 0.834, 'pos': 0.166, 'compound': 0.5563}"
427,2019-03-12,16:37:41+0000,The U.S. joins the investigation into the aircraft’s second deadly crash. But it hasn’t moved to ground the planes.,"{'neg': 0.13, 'neu': 0.87, 'pos': 0.0, 'compound': -0.4019}"
428,2019-05-06,22:41:02+0000,In the On Politics newsletter: Nearly every candidate can stake a claim as the most electable. It just depends on how you think the election will be won.,"{'neg': 0.0, 'neu': 0.875, 'pos': 0.125, 'compound': 0.5719}"
429,2019-06-14,13:00:05+0000,Millions of dollars’ worth of baseball cards are at stake as collectors question the authenticity of their purchases and wonder whom they can trust.,"{'neg': 0.0, 'neu': 0.809, 'pos': 0.191, 'compound': 0.6369}"
430,2019-06-26,09:00:23+0000,StockX is one of several online marketplaces that have turned resales of shoes into a big — and highly valued — business.,"{'neg': 0.0, 'neu': 0.849, 'pos': 0.151, 'compound': 0.4927}"
431,2019-04-25,09:00:11+0000,"Beijing is reshaping its plans for building a network of ports, rails and roads that enhance the country’s geopolitical ambitions. But it isn’t retreating.","{'neg': 0.0, 'neu': 1.0, 'pos': 0.0, 'compound': 0.0}"
432,2019-01-06,22:22:53+0000,The decision to remove an episode from its service in Saudi Arabia raises questions of whether entertainment giants will fight for values like free expression.,"{'neg': 0.077, 'neu': 0.59, 'pos': 0.333, 'compound': 0.8271}"
433,2019-04-04,11:47:09+0000,"In an interview, his wife, Carole Ghosn, described aggressive tactics and a thorough home search. Experts called his latest arrest in Japan an unusually forceful move.","{'neg': 0.148, 'neu': 0.852, 'pos': 0.0, 'compound': -0.4588}"
434,2019-01-28,23:34:52+0000,"In the On Politics newsletter, the former Starbucks chief is considering an independent run for the White House. But political scientists say his target audience is nearly extinct.","{'neg': 0.0, 'neu': 1.0, 'pos': 0.0, 'compound': 0.0}"
435,2019-06-01,19:31:55+0000,"President Trump sided with hard-liners in the administration over the objections of top aides, who said punishing Mexico with tariffs would be risky, multiple officials and people briefed on the plan said.","{'neg': 0.149, 'neu': 0.801, 'pos': 0.05, 'compound': -0.5574}"
436,2019-06-14,13:00:05+0000,Millions of dollars’ worth of baseball cards are at stake as collectors question the authenticity of their purchases and wonder whom they can trust.,"{'neg': 0.0, 'neu': 0.809, 'pos': 0.191, 'compound': 0.6369}"
437,2019-06-29,07:00:09+0000,"Businesses started by children contend with challenges that are typical, like identifying a mission, and not so typical, like knowing when someone else gets to be the boss.","{'neg': 0.0, 'neu': 0.754, 'pos': 0.246, 'compound': 0.6705}"
438,2019-05-12,23:43:42+0000,"As the trade war intensifies, Chinese subsidies for homegrown industries present a difficult obstacle to reaching a deal.","{'neg': 0.392, 'neu': 0.529, 'pos': 0.079, 'compound': -0.7964}"
439,2019-04-27,07:00:07+0000,Bike-sharing start-ups brought prosperity to Wangqingtuo. Now residents are dealing with the mess they left behind.,"{'neg': 0.143, 'neu': 0.857, 'pos': 0.0, 'compound': -0.3612}"
440,2019-06-17,15:22:21+0000,"From Calvin Klein to KFC, the rise of the computer-generated influencer on social media.","{'neg': 0.0, 'neu': 1.0, 'pos': 0.0, 'compound': 0.0}"
441,2019-06-26,09:00:23+0000,StockX is one of several online marketplaces that have turned resales of shoes into a big — and highly valued — business.,"{'neg': 0.0, 'neu': 0.849, 'pos': 0.151, 'compound': 0.4927}"
442,2019-04-25,09:00:11+0000,"Beijing is reshaping its plans for building a network of ports, rails and roads that enhance the country’s geopolitical ambitions. But it isn’t retreating.","{'neg': 0.0, 'neu': 1.0, 'pos': 0.0, 'compound': 0.0}"
443,2019-01-06,22:22:53+0000,The decision to remove an episode from its service in Saudi Arabia raises questions of whether entertainment giants will fight for values like free expression.,"{'neg': 0.077, 'neu': 0.59, 'pos': 0.333, 'compound': 0.8271}"
444,2019-04-04,11:47:09+0000,"In an interview, his wife, Carole Ghosn, described aggressive tactics and a thorough home search. Experts called his latest arrest in Japan an unusually forceful move.","{'neg': 0.148, 'neu': 0.852, 'pos': 0.0, 'compound': -0.4588}"
445,2019-01-28,23:34:52+0000,"In the On Politics newsletter, the former Starbucks chief is considering an independent run for the White House. But political scientists say his target audience is nearly extinct.","{'neg': 0.0, 'neu': 1.0, 'pos': 0.0, 'compound': 0.0}"
446,2019-06-01,19:31:55+0000,"President Trump sided with hard-liners in the administration over the objections of top aides, who said punishing Mexico with tariffs would be risky, multiple officials and people briefed on the plan said.","{'neg': 0.149, 'neu': 0.801, 'pos': 0.05, 'compound': -0.5574}"
447,2019-06-21,17:42:45+0000,"In defending his comments about working with segregationists, Joe Biden cited his record on civil rights and his relationship with Ted Kennedy. But he didn’t address his opposition to busing.","{'neg': 0.0, 'neu': 1.0, 'pos': 0.0, 'compound': 0.0}"
448,2019-05-14,22:16:12+0000,"TSX Broadway, which will a feature a theater, a hotel, a shopping center and an outdoor stage, is the latest effort by developers to lure visitors.","{'neg': 0.0, 'neu': 1.0, 'pos': 0.0, 'compound': 0.0}"
449,2019-04-17,19:13:15+0000,"Six months after agents from Saudi Arabia dismembered the writer Jamal Khashoggi, investors are no longer shying away from doing business with the kingdom.","{'neg': 0.157, 'neu': 0.843, 'pos': 0.0, 'compound': -0.4767}"
450,2019-01-21,21:54:41+0000,"Shao Chunyou rose from the assembly line to the boss’s office. Now the old recipes for success don’t work, and he must reinvent himself again.","{'neg': 0.0, 'neu': 0.866, 'pos': 0.134, 'compound': 0.5719}"
451,2019-03-31,18:36:41+0000,Britain’s complicated exit from the European Union has rattled corporations around the world. And that means lawyers are pulling in clients and profit.,"{'neg': 0.0, 'neu': 0.884, 'pos': 0.116, 'compound': 0.4404}"
452,2019-02-10,20:01:03+0000,Uber and Airbnb were part of an early generation of tech start-ups that quickly reached $1 billion in value. The up-and-coming generation is looking very different.,"{'neg': 0.0, 'neu': 0.863, 'pos': 0.137, 'compound': 0.4215}"
453,2019-01-20,17:21:42+0000,"In the past, China has helped to pull the global economy out of weak spots. This time, it might not come through.","{'neg': 0.121, 'neu': 0.879, 'pos': 0.0, 'compound': -0.4404}"
454,2019-04-04,09:00:11+0000,"American manufacturers have added jobs for 19 straight months, a streak that could extend to 20 on Friday. But there are signs the growth is slowing.","{'neg': 0.0, 'neu': 0.78, 'pos': 0.22, 'compound': 0.6369}"
455,2019-04-17,19:13:15+0000,"Six months after agents from Saudi Arabia dismembered the writer Jamal Khashoggi, investors are no longer shying away from doing business with the kingdom.","{'neg': 0.157, 'neu': 0.843, 'pos': 0.0, 'compound': -0.4767}"
456,2019-01-23,20:09:44+0000,"Nick Confessore, an investigative reporter who has written about social media and data privacy, has changed his tech habits after what he has learned.","{'neg': 0.0, 'neu': 1.0, 'pos': 0.0, 'compound': 0.0}"
457,2019-06-23,07:00:16+0000,"We asked the Democratic presidential candidates how they would improve the health care system. Some want to eliminate private insurance, but many others said that was a step too far.","{'neg': 0.0, 'neu': 0.833, 'pos': 0.167, 'compound': 0.4939}"
458,2019-04-01,10:38:36+0000,"The state-owned oil company’s books, opened as part of a $10 billion bond offering, reveal that it’s by far the world’s most profitable company.","{'neg': 0.0, 'neu': 0.873, 'pos': 0.127, 'compound': 0.4927}"
459,2019-06-19,09:00:07+0000,"As President Trump deploys tariffs as weapons in international disputes, he has ceded the American role as champion of global trade.","{'neg': 0.186, 'neu': 0.669, 'pos': 0.145, 'compound': -0.0258}"
460,2019-04-01,10:38:36+0000,"The state-owned oil company’s books, opened as part of a $10 billion bond offering, reveal that it’s by far the world’s most profitable company.","{'neg': 0.0, 'neu': 0.873, 'pos': 0.127, 'compound': 0.4927}"
461,2019-05-03,09:00:09+0000,"Businesses are scrambling for workers in Hungary, where Prime Minister Viktor Orban limits work permits for foreigners and rails against immigrants.","{'neg': 0.0, 'neu': 1.0, 'pos': 0.0, 'compound': 0.0}"
462,2019-04-05,14:53:15+0000,"“I’m sorry I didn’t understand more,” Mr. Biden said about his hugs and kisses to women over the years. “I’m not sorry for any of my intentions.”","{'neg': 0.084, 'neu': 0.707, 'pos': 0.209, 'compound': 0.7096}"
463,2019-02-18,17:43:32+0000,Virgin Hyperloop One is testing a system that would put passengers in pods hurtling through vacuum tubes. Other companies are moving ahead with similar plans.,"{'neg': 0.094, 'neu': 0.906, 'pos': 0.0, 'compound': -0.34}"
464,2019-03-22,05:52:49+0000,Signs suggest that a monthslong slump in the world’s most unaffordable property market is ending.,"{'neg': 0.0, 'neu': 1.0, 'pos': 0.0, 'compound': 0.0}"
465,2019-03-24,10:52:03+0000,How much will the company be valued at? What can go wrong? Who stands to get rich? Let us answer all those questions and more.,"{'neg': 0.096, 'neu': 0.685, 'pos': 0.219, 'compound': 0.6046}"
466,2019-04-15,09:00:06+0000,President Trump’s unpredictable style has brought foreign countries to the negotiating table. But will it result in the United States leaving with more?,"{'neg': 0.0, 'neu': 0.887, 'pos': 0.113, 'compound': 0.4215}"
467,2019-03-13,09:00:08+0000,"As some of Silicon Valley’s most prominent start-ups prepare to go public, networks of their former employees are expected to plow big sums of money into a new generation of firms.","{'neg': 0.0, 'neu': 0.918, 'pos': 0.082, 'compound': 0.3804}"
468,2019-04-14,08:51:07+0000,How much will the company be valued at? What can go wrong? Who stands to get rich? What does it mean for other I. P. O.s? Let us answer all those questions and more.,"{'neg': 0.075, 'neu': 0.746, 'pos': 0.179, 'compound': 0.6553}"
469,2019-03-12,23:43:26+0000,"Boeing’s chief made a personal appeal to President Trump, calling from Chicago to express his confidence in the safety of the company’s 737 Max 8 jets.","{'neg': 0.0, 'neu': 0.783, 'pos': 0.217, 'compound': 0.7269}"
470,2019-02-13,18:00:07+0000,"In a country where wealth usually comes from mining or banking, Scott Farquhar and Mike Cannon-Brookes of Atlassian are a new kind of mogul. And they’re getting into politics.","{'neg': 0.0, 'neu': 0.89, 'pos': 0.11, 'compound': 0.4939}"
471,2019-02-04,22:36:59+0000,"A small group of well-educated professionals enjoys rising wages, while most workers toil in low-wage jobs with few chances to advance.","{'neg': 0.0, 'neu': 0.779, 'pos': 0.221, 'compound': 0.6249}"
472,2019-03-24,10:52:03+0000,How much will the company be valued at? What can go wrong? Who stands to get rich? Let us answer all those questions and more.,"{'neg': 0.096, 'neu': 0.685, 'pos': 0.219, 'compound': 0.6046}"
473,2019-02-04,11:36:40+0000,"Weakened demand for semiconductors is hurting the financials of big technology firms, and it could be a sign of a broader slowdown.","{'neg': 0.277, 'neu': 0.723, 'pos': 0.0, 'compound': -0.6705}"
474,2019-06-26,20:20:06+0000,"Mr. Bullock, the governor of Montana, is trying to make the most of his failure to qualify, holding televised events on both days of the debate.","{'neg': 0.125, 'neu': 0.875, 'pos': 0.0, 'compound': -0.552}"
475,2019-04-22,11:01:36+0000,"The electric-car maker plans to show off its latest self-driving vehicle technology, two days before it is expected to announce another quarterly loss.","{'neg': 0.095, 'neu': 0.905, 'pos': 0.0, 'compound': -0.3182}"
476,2019-06-24,07:00:07+0000,"The debates on Wednesday and Thursday nights may represent the best — and for some, the only — opportunity to stand out in an enormous primary field.","{'neg': 0.0, 'neu': 0.767, 'pos': 0.233, 'compound': 0.7906}"
477,2019-01-24,11:57:30+0000,"After a day of brinkmanship with Speaker Nancy Pelosi, President Trump said that he would deliver his State of the Union address once the government reopened.","{'neg': 0.0, 'neu': 1.0, 'pos': 0.0, 'compound': 0.0}"
478,2019-06-06,10:20:38+0000,French demands and a fear of the new company being seen as politically influenced reportedly caused the deal to crash.,"{'neg': 0.258, 'neu': 0.742, 'pos': 0.0, 'compound': -0.7096}"
479,2019-01-02,17:00:47+0000,"The fairness of elections and voting have become political flash points in key states like Florida, Georgia, Michigan, North Carolina, Pennsylvania and Wisconsin.","{'neg': 0.0, 'neu': 0.898, 'pos': 0.102, 'compound': 0.3612}"
480,2019-03-25,19:54:35+0000,Clayton Morris has been sued by nearly two dozen customers who say they were sold ramshackle homes as investment properties.,"{'neg': 0.0, 'neu': 1.0, 'pos': 0.0, 'compound': 0.0}"
481,2019-06-06,10:20:38+0000,French demands and a fear of the new company being seen as politically influenced reportedly caused the deal to crash.,"{'neg': 0.258, 'neu': 0.742, 'pos': 0.0, 'compound': -0.7096}"
482,2019-01-02,17:00:47+0000,"The fairness of elections and voting have become political flash points in key states like Florida, Georgia, Michigan, North Carolina, Pennsylvania and Wisconsin.","{'neg': 0.0, 'neu': 0.898, 'pos': 0.102, 'compound': 0.3612}"
483,2019-02-01,17:29:11+0000,"More than 100,000 women are resolving claims against companies that made pelvic mesh products to treat urinary problems. Lawyers have found ways to take big chunks of their payouts.","{'neg': 0.079, 'neu': 0.765, 'pos': 0.156, 'compound': 0.3818}"
484,2019-01-13,18:30:52+0000,"No state stunned Democrats more than Florida, where Republicans thwarted the forces that are lifting Democrats elsewhere. The battleground state is tilting more to the right.","{'neg': 0.252, 'neu': 0.748, 'pos': 0.0, 'compound': -0.6597}"
485,2019-04-02,10:22:54+0000,"Investors have decided that the ride-hailing service was overvalued after its I.P.O. That spells trouble for Lyft, and other unicorns looking to go public.","{'neg': 0.105, 'neu': 0.895, 'pos': 0.0, 'compound': -0.4019}"
486,2019-03-21,10:17:07+0000,"Central bank forecasts suggest that it won’t raise rates this year, and Wall Street couldn’t be happier.","{'neg': 0.0, 'neu': 0.825, 'pos': 0.175, 'compound': 0.5267}"
487,2019-03-18,10:46:54+0000,"In the wake of two fatal crashes, Boeing finds itself with prosecutors and regulators inspecting its development processes and safety assessments.","{'neg': 0.138, 'neu': 0.751, 'pos': 0.111, 'compound': -0.1779}"
488,2019-05-31,10:08:32+0000,New tariffs on all imported goods from Mexico are a dare to stop the flow of undocumented immigrants — and a tax rise that could start at over $17 billion a year.,"{'neg': 0.075, 'neu': 0.925, 'pos': 0.0, 'compound': -0.296}"
489,2019-03-09,15:28:27+0000,"The leading Democratic candidates have largely broken with consensus-driven politics and embraced progressive ideas on health care, taxes, the environment and Middle East policy.","{'neg': 0.11, 'neu': 0.777, 'pos': 0.113, 'compound': 0.0258}"
490,2019-06-27,02:33:06+0000,"Elizabeth Warren set the tone for the party’s progressive wing, but others among the 10 candidates were more cautious, producing clashes along ideological lines.","{'neg': 0.081, 'neu': 0.919, 'pos': 0.0, 'compound': -0.2592}"
491,2019-01-31,11:51:22+0000,"The central bank signaled that its march toward higher interest rates may be ending sooner than expected, and investors cheered.","{'neg': 0.0, 'neu': 0.741, 'pos': 0.259, 'compound': 0.743}"
492,2019-04-16,09:00:17+0000,"Members of the party establishment who oppose Bernie Sanders have had discussions about how to handle his candidacy, while others warn of a schism within the party.","{'neg': 0.047, 'neu': 0.772, 'pos': 0.181, 'compound': 0.6124}"
493,2019-04-10,10:33:07+0000,"The I.M.F. has cut its global growth outlook for the year, but things could be far worse.","{'neg': 0.265, 'neu': 0.651, 'pos': 0.084, 'compound': -0.5994}"
494,2019-02-26,11:35:11+0000,The energy company will fund an initiative run by the nonprofit Catalyst that teaches male executives how to improve inclusion at their companies.,"{'neg': 0.0, 'neu': 0.808, 'pos': 0.192, 'compound': 0.6124}"
495,2019-02-15,11:27:06+0000,The company’s decision could be a turning point for corporate-civic relations in the U.S. and a sign that leftist views are gaining traction.,"{'neg': 0.0, 'neu': 0.877, 'pos': 0.123, 'compound': 0.4215}"
496,2019-03-05,11:26:29+0000,Beijing has promised to offer companies tax breaks and letting the markets play a bigger role. It may not be enough.,"{'neg': 0.0, 'neu': 0.786, 'pos': 0.214, 'compound': 0.5994}"
497,2019-02-02,17:00:04+0000,"Many liberals who are influential in the presidential primaries want a single-payer system, but some voters are uneasy about losing private insurance. Most candidates are now walking fine lines.","{'neg': 0.194, 'neu': 0.655, 'pos': 0.151, 'compound': -0.5423}"
498,2019-03-01,11:48:52+0000,The automaker’s long-held plan to sell a cheap electric car will require cost cutting and a descent into unprofitability.,"{'neg': 0.086, 'neu': 0.914, 'pos': 0.0, 'compound': -0.128}"
499,2019-04-29,15:10:31+0000,"In Ohio, where companies like FirstEnergy and Goodyear pay no federal corporate taxes, Democrats haven’t figured out how to leverage anxiety over income inequality to defeat President Trump.","{'neg': 0.246, 'neu': 0.68, 'pos': 0.074, 'compound': -0.5859}"
500,2019-04-25,10:01:18+0000,The former vice president has stayed on the sidelines while his record has been scrutinized. His entry is sure to reshape the Democratic primary contest.,"{'neg': 0.0, 'neu': 0.913, 'pos': 0.087, 'compound': 0.3182}"
501,2019-03-29,10:15:12+0000,"The ride-hailing service begins trading on the Nasdaq this morning, and is now valued at more than $24 billion.","{'neg': 0.0, 'neu': 0.861, 'pos': 0.139, 'compound': 0.4404}"
502,2019-03-25,10:21:31+0000,"Legal challenges still stand in the way of the White House, despite Robert Mueller’s good news for President Trump.","{'neg': 0.113, 'neu': 0.755, 'pos': 0.132, 'compound': -0.1546}"
503,2019-03-22,10:18:07+0000,"The former head of McKinsey spent time in prison for tipping an insider-trading ring. Now, Mr. Gupta is speaking out — but not apologizing.","{'neg': 0.088, 'neu': 0.858, 'pos': 0.054, 'compound': -0.2064}"
504,2019-04-03,10:37:20+0000,A New York Times investigation reveals how much power the Murdoch media machine wields — and uncovers the cracks within the family that controls it.,"{'neg': 0.0, 'neu': 1.0, 'pos': 0.0, 'compound': 0.0}"
505,2019-01-08,11:42:02+0000,"An approach meant to treat students as investments rather than cash cows is being tested by Lambda School, an online learning start-up.","{'neg': 0.0, 'neu': 0.886, 'pos': 0.114, 'compound': 0.4019}"
506,2019-06-07,10:14:42+0000,Executives thought that France would probably never stop trying to exert control if the company was joined with Renault.,"{'neg': 0.0, 'neu': 0.905, 'pos': 0.095, 'compound': 0.2235}"
507,2019-04-15,15:19:49+0000,France’s so-called Yellow Vest protesters are animated by more than anger at the rich: They seek a protected and expanded social safety net.,"{'neg': 0.183, 'neu': 0.528, 'pos': 0.289, 'compound': 0.5302}"
508,2019-03-11,10:49:31+0000,"Two deadly crashes in five months involving 737 Max planes have many questioning the safety of the aircraft, which forms the heart of Boeing’s business.","{'neg': 0.051, 'neu': 0.846, 'pos': 0.103, 'compound': 0.34}"
509,2019-04-04,05:00:01+0000,"Hundreds of influential faces in global politics, art, fashion and design descended on this tiny desert kingdom last week.","{'neg': 0.0, 'neu': 0.861, 'pos': 0.139, 'compound': 0.4404}"
510,2019-02-28,11:54:19+0000,Testimony from the president’s former personal lawyer painted an unflattering picture of how the Trump Organization has been operated.,"{'neg': 0.0, 'neu': 1.0, 'pos': 0.0, 'compound': 0.0}"
511,2019-02-08,11:44:52+0000,"The Amazon C.E.O. accused The National Enquirer of trying to hold him to ransom in a conspiracy theory involving the White House, an affair and revealing images.","{'neg': 0.185, 'neu': 0.759, 'pos': 0.056, 'compound': -0.5994}"
512,2019-01-10,11:40:22+0000,"The U.S. and China identified the issues between them, setting the stage for potential talks with top leaders from both countries.","{'neg': 0.0, 'neu': 0.917, 'pos': 0.083, 'compound': 0.2023}"
513,2019-01-14,11:34:44+0000,"MNG Enterprises, the owner of one of the largest newspaper businesses in the country, made a takeover offer for Gannett. But it has been rebuffed before.","{'neg': 0.0, 'neu': 1.0, 'pos': 0.0, 'compound': 0.0}"
514,2019-04-03,10:37:20+0000,A New York Times investigation reveals how much power the Murdoch media machine wields — and uncovers the cracks within the family that controls it.,"{'neg': 0.0, 'neu': 1.0, 'pos': 0.0, 'compound': 0.0}"
515,2019-01-08,11:42:02+0000,"An approach meant to treat students as investments rather than cash cows is being tested by Lambda School, an online learning start-up.","{'neg': 0.0, 'neu': 0.886, 'pos': 0.114, 'compound': 0.4019}"
516,2019-02-21,15:35:45+0000,"The technology is feasible for a Green New Deal, though experts doubt its goals could be accomplished as quickly as advocates hope. Finding money and political will is a bigger challenge.","{'neg': 0.072, 'neu': 0.723, 'pos': 0.205, 'compound': 0.5574}"
517,2019-02-21,11:33:30+0000,"As the talks wear on, key demands could be softened in order to seal an agreement.","{'neg': 0.0, 'neu': 0.824, 'pos': 0.176, 'compound': 0.4939}"
518,2019-03-15,10:53:45+0000,"A fight has broken out between TPG and Bill McGlashan, the senior executive caught up in a huge college bribery scandal, over how he left the company.","{'neg': 0.27, 'neu': 0.658, 'pos': 0.072, 'compound': -0.743}"
519,2019-01-27,12:00:03+0000,"Here’s a wrap up of everything that we think was important that happened at the World Economic Forum in Davos, Switzerland.","{'neg': 0.0, 'neu': 0.913, 'pos': 0.087, 'compound': 0.2023}"
520,2019-02-06,21:52:54+0000,"Mr. O’Rourke, considering a run for president, took to the road to find answers. And he wrote quite a bit about it.","{'neg': 0.0, 'neu': 1.0, 'pos': 0.0, 'compound': 0.0}"
521,2019-04-10,23:44:20+0000,"The president’s tax returns would provide insight into how much money he is making, or losing, each year, but they would not fully illuminate the sources of his wealth.","{'neg': 0.054, 'neu': 0.816, 'pos': 0.13, 'compound': 0.5423}"
522,2019-05-03,00:51:13+0000,The California utility disclosed in a filing that securities regulators are looking into how it disclosed and accounted for losses from fires in recent years.,"{'neg': 0.1, 'neu': 0.818, 'pos': 0.082, 'compound': -0.128}"
523,2019-04-15,19:11:18+0000,"Honors go to The New York Times, The Wall Street Journal and The South Florida Sun Sentinel. And there was a posthumous award for Aretha Franklin.","{'neg': 0.0, 'neu': 0.772, 'pos': 0.228, 'compound': 0.7783}"
524,2019-03-11,15:35:53+0000,The choice places a spotlight on a key Midwestern battleground state that the party lost for the first time in three decades in 2016 and sees as central to its efforts at reclaiming the White House.,"{'neg': 0.129, 'neu': 0.801, 'pos': 0.07, 'compound': -0.3182}"
525,2019-04-15,22:00:26+0000,"Mr. Sanders’s income shot up after his last presidential bid, topping $1 million in 2016 and 2017 as proceeds from books drove up his earnings.","{'neg': 0.0, 'neu': 1.0, 'pos': 0.0, 'compound': 0.0}"
526,2019-05-31,09:00:25+0000,The failure of the Rosewood Care Centers is the biggest default in the history of a little-known program that underpins 15 percent of the nation’s nursing homes.,"{'neg': 0.108, 'neu': 0.787, 'pos': 0.105, 'compound': -0.0258}"
527,2019-03-28,20:27:13+0000,A sudden drop in the central bank’s foreign reserves sparked fears about the country’s economic stewardship.,"{'neg': 0.274, 'neu': 0.726, 'pos': 0.0, 'compound': -0.5994}"
528,2019-02-27,23:41:48+0000,Argosy University teetered on the edge of collapse after the federal government accused it of misusing money that was owed to students.,"{'neg': 0.213, 'neu': 0.787, 'pos': 0.0, 'compound': -0.6597}"
529,2019-02-05,19:42:53+0000,"The Massachusetts senator, who has campaigned against wealth inequality, remains fairly wealthy herself, though well behind several other senators.","{'neg': 0.0, 'neu': 0.672, 'pos': 0.328, 'compound': 0.7783}"
530,2019-04-18,23:06:44+0000,The adversaries told a judge they were working to resolve a dispute over Mr. Musk’s statements on financial prospects. Regulators had sought a contempt citation.,"{'neg': 0.281, 'neu': 0.561, 'pos': 0.158, 'compound': -0.5719}"
531,2019-02-05,19:42:53+0000,"The Massachusetts senator, who has campaigned against wealth inequality, remains fairly wealthy herself, though well behind several other senators.","{'neg': 0.0, 'neu': 0.672, 'pos': 0.328, 'compound': 0.7783}"
532,2019-01-17,11:42:32+0000,"The founder of Vanguard, who died on Wednesday, changed how ordinary people invested. Here are some of his tips.","{'neg': 0.167, 'neu': 0.833, 'pos': 0.0, 'compound': -0.5574}"
