,date,time,abstract,sentiment_score
0,2019-06-28,19:52:21+0000,"Young adults are more likely to reside with their parents than previous generations did, leading to a need for guidelines on how to manage the stay.","{'neg': 0.0, 'neu': 1.0, 'pos': 0.0, 'compound': 0.0}"
1,2019-06-29,15:26:37+0000,"Ms. Harris collected donations from 63,277 people, according to a campaign aide. The aide said 58 percent of those donors had not contributed to her campaign before.","{'neg': 0.0, 'neu': 1.0, 'pos': 0.0, 'compound': 0.0}"
2,2019-06-28,18:41:44+0000,The German bank is said to be preparing a sweeping restructuring that will eliminate thousands of jobs and bring to an end its 20-year foray into Wall Street.,"{'neg': 0.0, 'neu': 1.0, 'pos': 0.0, 'compound': 0.0}"
3,2019-06-27,20:30:03+0000,"The Federal Reserve said the largest banks were generally well prepared to withstand a severe crisis, although Credit Suisse must improve its operations.","{'neg': 0.208, 'neu': 0.497, 'pos': 0.295, 'compound': 0.2023}"
4,2019-06-21,14:18:50+0000,Consumer advocates say the overdraft rule has helped people avoid excessive penalties — like the cup of coffee that ends up costing $38.,"{'neg': 0.089, 'neu': 0.81, 'pos': 0.101, 'compound': 0.0772}"
5,2019-06-25,14:44:16+0000,"The New Jersey senator is a gifted orator with a glittering résumé, but he often pulls back from political infighting. The debates offer him a chance to break out.","{'neg': 0.0, 'neu': 0.909, 'pos': 0.091, 'compound': 0.3612}"
6,2019-06-25,23:28:01+0000,The social media company said it had signed 27 partners to its Libra project. But executives at some of those companies said they were approaching it warily.,"{'neg': 0.0, 'neu': 1.0, 'pos': 0.0, 'compound': 0.0}"
7,2019-06-25,17:00:06+0000,Mr. Powell underlined the Fed’s insulation from politics and kept the door open for interest rate cuts at a time of trade uncertainty.,"{'neg': 0.173, 'neu': 0.714, 'pos': 0.113, 'compound': -0.1531}"
8,2019-06-24,21:08:01+0000,"From Lyndon Johnson to Richard Nixon, presidents have long had fraught relationships with Fed chairs.","{'neg': 0.0, 'neu': 1.0, 'pos': 0.0, 'compound': 0.0}"
9,2019-06-20,11:00:06+0000,"A New York hotel union is directing donations to the mayor, with an eye on influencing the next mayor’s race in addition to the presidential contest.","{'neg': 0.0, 'neu': 1.0, 'pos': 0.0, 'compound': 0.0}"
10,2019-06-21,15:52:00+0000,"The presidents of the St. Louis and Minneapolis branches of the Federal Reserve want rates cut now, and even the central bank’s vice chair says uncertainty is growing.","{'neg': 0.143, 'neu': 0.762, 'pos': 0.095, 'compound': -0.3612}"
11,2019-06-18,03:28:20+0000,Mr. Biden revealed his campaign’s finances at a fund-raiser in New York on Monday night. It’s more than any other candidate raised in the first quarter of the year.,"{'neg': 0.0, 'neu': 1.0, 'pos': 0.0, 'compound': 0.0}"
12,2019-06-19,16:13:42+0000,President Trump’s fund-raising haul for his re-election kickoff was more than five leading Democrats raised in their first 24 hours — combined.,"{'neg': 0.0, 'neu': 1.0, 'pos': 0.0, 'compound': 0.0}"
13,2019-06-19,20:00:20+0000,"Federal authorities are focused on whether the bank complied with anti-money-laundering laws, including in its review of transactions linked to Jared Kushner.","{'neg': 0.0, 'neu': 0.89, 'pos': 0.11, 'compound': 0.3818}"
14,2019-06-16,09:00:13+0000,"Joe Biden, Pete Buttigieg and Kamala Harris are generating the most buzz, but for different reasons. Hometown candidates like Kirsten Gillibrand and Bill de Blasio are stirring less excitement.","{'neg': 0.0, 'neu': 0.792, 'pos': 0.208, 'compound': 0.797}"
15,2019-06-17,09:00:06+0000,Mr. Biden is betting that his widespread name recognition and early poll results free him to focus on President Trump — and brush off his 22 Democratic opponents.,"{'neg': 0.0, 'neu': 0.887, 'pos': 0.113, 'compound': 0.5106}"
16,2019-06-18,12:04:24+0000,"President Trump is increasingly viewing international economic policy through a narrow lens, seeing only how other countries decisions affect the United States.","{'neg': 0.0, 'neu': 0.877, 'pos': 0.123, 'compound': 0.4215}"
17,2019-06-17,03:59:08+0000,The exiting president of the E.C.B. famously vowed to do “whatever it takes” to preserve the eurozone currency. It is unclear whether whoever follows him can be counted on to do the same.,"{'neg': 0.059, 'neu': 0.941, 'pos': 0.0, 'compound': -0.25}"
18,2019-06-14,10:00:07+0000,"The cards, used mainly by consumers who have little credit history or a poor one, haven’t been widely adopted. Amazon is now offering one.","{'neg': 0.114, 'neu': 0.738, 'pos': 0.148, 'compound': -0.024}"
19,2019-06-11,09:00:10+0000,"New and untested players, some backed by Wall Street, have helped borrowers pile up billions in loans. What could go wrong?","{'neg': 0.134, 'neu': 0.819, 'pos': 0.047, 'compound': -0.4588}"
20,2019-06-11,09:00:08+0000,"With zero certainty about what lies ahead, analysts are standing pat on earnings forecasts. If they start to cut targets, stocks could be in for a dive.","{'neg': 0.164, 'neu': 0.769, 'pos': 0.067, 'compound': -0.4404}"
21,2019-06-10,15:46:52+0000,The sloppy screening of corporate transactions is the latest blow to the bank’s reputation only days after its shares hit a record low.,"{'neg': 0.086, 'neu': 0.823, 'pos': 0.091, 'compound': 0.0258}"
22,2019-06-07,21:33:44+0000,The deal would resolve a case brought by customers who took out car loans and were forced to pay for unnecessary auto insurance without their knowledge.,"{'neg': 0.152, 'neu': 0.759, 'pos': 0.09, 'compound': -0.2023}"
23,2019-06-06,13:40:16+0000,"Until recently big tech companies were seen as one of the few relatively untainted sources of big-money donations for Democrats. Now, that’s changing.","{'neg': 0.0, 'neu': 1.0, 'pos': 0.0, 'compound': 0.0}"
24,2019-06-07,11:00:06+0000,"Advocates say the state-based accounts, which let disabled people work and save money without risking the loss of government aid, could help millions of people.","{'neg': 0.0, 'neu': 0.681, 'pos': 0.319, 'compound': 0.8327}"
25,2019-06-06,15:48:28+0000,"Seven Democrats, including the presidential candidate Elizabeth Warren, want the Fed to examine the bank’s compliance with anti-money-laundering laws over flagged transactions.","{'neg': 0.0, 'neu': 0.942, 'pos': 0.058, 'compound': 0.0772}"
26,2019-06-04,22:18:54+0000,"Customers with Chase credit cards received notifications informing them their rights to sue would end unless they opted out, in writing, by Aug. 7.","{'neg': 0.0, 'neu': 0.898, 'pos': 0.102, 'compound': 0.3818}"
27,2019-06-04,09:00:08+0000,A sampling of the changes that would be made by retirement legislation passed by the House.,"{'neg': 0.0, 'neu': 1.0, 'pos': 0.0, 'compound': 0.0}"
28,2019-06-03,23:45:01+0000,"Peter Chernin sent an email seeking donations from entertainment power players like Jeff Bezos, Shonda Rhimes, Tim Cook, Ari Emanuel and Ted Sarandos.","{'neg': 0.0, 'neu': 0.798, 'pos': 0.202, 'compound': 0.6486}"
29,2019-06-02,17:50:36+0000,"Mr. Sanders held a small event at a nightclub, with tickets starting at $27, in a bid to keep his grip on small donors.","{'neg': 0.0, 'neu': 1.0, 'pos': 0.0, 'compound': 0.0}"
30,2019-05-31,19:28:33+0000,"The suit sheds light on concerns around donor-advised funds, which disburse money over time but offer an immediate tax deduction.","{'neg': 0.0, 'neu': 1.0, 'pos': 0.0, 'compound': 0.0}"
31,2019-05-31,09:00:15+0000,"We’ve got budget, retirement account, credit, information security and insurance advice for your independent adult, college student, gap-year taker or future soldier.","{'neg': 0.0, 'neu': 0.8, 'pos': 0.2, 'compound': 0.6124}"
32,2019-05-31,08:39:01+0000,"Stocks fell more than 6 percent in May, as threats to the global economy seemed to proliferate by the week, with tariffs rising and talks yielding no meaningful results.","{'neg': 0.155, 'neu': 0.774, 'pos': 0.071, 'compound': -0.4019}"
33,2019-05-30,18:18:16+0000,"A threshold of 130,000 donors will force campaigns to spend more on digital ads they hope will go viral, an expensive redirection of resources, some campaigns said.","{'neg': 0.0, 'neu': 0.896, 'pos': 0.104, 'compound': 0.4404}"
34,2019-05-30,17:43:30+0000,"Richard Clarida, the Fed’s vice chairman, said persistently low inflation or worsening global economic risks could make officials reconsider their patience.","{'neg': 0.286, 'neu': 0.714, 'pos': 0.0, 'compound': -0.7351}"
35,2019-05-29,21:06:08+0000,The agency is using its authority under a new cybersecurity regulation to investigate a mistake by a title insurer that revealed a trove of sensitive data.,"{'neg': 0.101, 'neu': 0.844, 'pos': 0.055, 'compound': -0.2732}"
36,2019-05-30,14:00:04+0000,"As more employers offer paid time off after childbirth, a class-action suit has yielded a settlement in which JPMorgan has pledged equal treatment for men and women.","{'neg': 0.0, 'neu': 1.0, 'pos': 0.0, 'compound': 0.0}"
37,2019-05-28,17:19:20+0000,"As some inside and outside the White House call for weakening China’s links to U.S. financial markets, e-commerce giant Alibaba is considering listing its shares in Hong Kong.","{'neg': 0.075, 'neu': 0.852, 'pos': 0.072, 'compound': -0.0258}"
38,2019-05-28,09:00:10+0000,"Declining to hold big-dollar fund-raisers and rolling out one policy proposal after another, Ms. Warren has strengthened her candidacy, though questions about her financial viability remain.","{'neg': 0.0, 'neu': 0.899, 'pos': 0.101, 'compound': 0.4215}"
39,2019-05-27,09:00:05+0000,"The competitive lanes are set as candidates vie for black voters, women, younger voters — but they are fluid. One thing seems sure: Joseph R. Biden’s lead will be tested.","{'neg': 0.0, 'neu': 0.863, 'pos': 0.137, 'compound': 0.5106}"
40,2019-05-24,16:17:12+0000,"The number of 529 accounts has grown in the past few years. But most people still haven’t heard of the plans or know about their tax benefits, research shows.","{'neg': 0.0, 'neu': 0.874, 'pos': 0.126, 'compound': 0.4404}"
41,2019-05-23,16:01:26+0000,"Household finances are improving in a strong job market, but just six in 10 adults still could cover a surprise expense without selling something or borrowing money.","{'neg': 0.0, 'neu': 0.767, 'pos': 0.233, 'compound': 0.6908}"
42,2019-05-23,14:24:22+0000,"At its annual shareholders meeting, the bank’s chairman faced pressure to resign amid a money-laundering scandal and meager profits.","{'neg': 0.307, 'neu': 0.574, 'pos': 0.119, 'compound': -0.5574}"
43,2019-05-22,20:29:26+0000,"A federal judge rejected President Trump’s efforts to block banks from complying with congressional subpoenas, and New York lawmakers voted to let Congress obtain his state tax returns.","{'neg': 0.199, 'neu': 0.801, 'pos': 0.0, 'compound': -0.7351}"
44,2019-05-22,13:44:34+0000,The bank’s acknowledgment that faulty software had been used to screen transactions for suspicious activity came a day before executives prepared to face restive investors at an annual meeting.,"{'neg': 0.151, 'neu': 0.789, 'pos': 0.06, 'compound': -0.4404}"
45,2019-05-22,18:42:49+0000,"Federal Reserve officials said they were committed to a “patient approach,” even if the economy strengthened, and some were worried about persistently low inflation.","{'neg': 0.152, 'neu': 0.674, 'pos': 0.174, 'compound': 0.1531}"
46,2019-05-21,09:00:12+0000,"While some of the 2020 Democrats have sworn off big donors, Joe Biden and his campaign have welcomed them into the fold.","{'neg': 0.0, 'neu': 0.897, 'pos': 0.103, 'compound': 0.34}"
47,2019-05-21,19:00:08+0000,"Judy Shelton, a longtime Fed critic who favors gradually taking interest rates to zero, is being considered for a seat on the board of governors.","{'neg': 0.077, 'neu': 0.738, 'pos': 0.185, 'compound': 0.4404}"
48,2019-05-19,23:05:32+0000,"When it comes to disinformation, all signs suggest the 2020 presidential campaign will make 2016 look like a mere test run, our columnist writes.","{'neg': 0.0, 'neu': 0.898, 'pos': 0.102, 'compound': 0.3612}"
49,2019-05-20,18:58:33+0000,"Some 2.75 trillion points and miles are earned each year, with many more options on where to spend them. Airline tickets and hotel rooms may be the best choices.","{'neg': 0.0, 'neu': 0.87, 'pos': 0.13, 'compound': 0.6369}"
50,2019-05-19,16:01:05+0000,Anti-money-laundering specialists proposed filing “suspicious activity reports” about transactions connected to President Trump and Jared Kushner. Bank managers said no.,"{'neg': 0.104, 'neu': 0.896, 'pos': 0.0, 'compound': -0.296}"
51,2019-05-17,15:32:25+0000,The New York senator is mired near the bottom of most polls but hopes to jump-start her campaign and fund-raising as she aggressively criticizes anti-abortion laws in Alabama and other states.,"{'neg': 0.159, 'neu': 0.734, 'pos': 0.107, 'compound': -0.2393}"
52,2019-05-17,14:22:31+0000,"The rates, which will take effect on July 1, won’t make a big difference in monthly payments. But given the cost of college, one expert says, “this is a bit of good news.”","{'neg': 0.0, 'neu': 0.912, 'pos': 0.088, 'compound': 0.4404}"
53,2019-05-17,13:00:04+0000,"Offering the chance of outsize returns on the back of a huge tax break, opportunity zones are attractive to investors. But there is a catch.","{'neg': 0.0, 'neu': 0.655, 'pos': 0.345, 'compound': 0.8402}"
54,2019-05-15,12:28:25+0000,The authorities raided 11 offices on Wednesday as part of an investigation into the possible concealment of capital gains in offshore companies.,"{'neg': 0.0, 'neu': 0.897, 'pos': 0.103, 'compound': 0.34}"
55,2019-05-10,16:49:04+0000,"Anything these companies can do, people can do for themselves at no cost. Federal regulators recently filed suit against two of the biggest companies.","{'neg': 0.087, 'neu': 0.913, 'pos': 0.0, 'compound': -0.296}"
56,2019-05-10,13:00:06+0000,"The ability to deduct business losses against income tax is common. But there are myriad other benefits, all legal, created specifically for commercial real estate.","{'neg': 0.087, 'neu': 0.643, 'pos': 0.27, 'compound': 0.5719}"
57,2019-05-09,13:30:10+0000,"Each year, we ask high school seniors to submit college application essays they’ve written about work, money, social class and related topics. Here are five that moved us.","{'neg': 0.0, 'neu': 1.0, 'pos': 0.0, 'compound': 0.0}"
58,2019-05-06,15:09:48+0000,"Roger Ng was arraigned in federal court in Brooklyn on Monday, just hours after being flown back from Malaysia, where he also faces charges.","{'neg': 0.084, 'neu': 0.916, 'pos': 0.0, 'compound': -0.2732}"
59,2019-05-04,11:52:00+0000,Tens of thousands of shareholders attended the annual meeting of Warren Buffett’s Berkshire Hathaway. DealBook provided analysis through it all.,"{'neg': 0.0, 'neu': 1.0, 'pos': 0.0, 'compound': 0.0}"
60,2019-05-03,18:20:15+0000,"Despite low inflation and White House cajoling, Fed officials continued to suggest a path of inaction on interest rates.","{'neg': 0.092, 'neu': 0.688, 'pos': 0.221, 'compound': 0.4242}"
61,2019-05-03,14:29:12+0000,"The Federal Trade Commission says it has seen fraudulent calls from Social Security impostors “skyrocket,” overtaking fake I.R.S. calls.","{'neg': 0.255, 'neu': 0.648, 'pos': 0.097, 'compound': -0.5994}"
62,2019-05-02,22:44:35+0000,"The territory and a group of unsecured creditors brought their complaint against dozens of financial firms, including some of the country’s biggest banks.","{'neg': 0.194, 'neu': 0.806, 'pos': 0.0, 'compound': -0.5859}"
63,2019-05-02,16:44:59+0000,"Ms. Warren has hired about 50 people in Iowa, giving her a head start at organizing for next year’s caucuses. But it’s a strategy loaded with risk.","{'neg': 0.076, 'neu': 0.836, 'pos': 0.087, 'compound': 0.0772}"
64,2019-04-30,18:47:38+0000,"President Trump and Deutsche Bank had a long, symbiotic relationship. Now, Mr. Trump is racing to prevent the bank from sharing his financial information with Congress.","{'neg': 0.0, 'neu': 0.855, 'pos': 0.145, 'compound': 0.4404}"
65,2019-04-30,09:00:13+0000,"In amassing a small fortune, the South Bend mayor has had the backing of an exuberant L.G.B.T. donor base. But relying on wealthy contributors carries political risk.","{'neg': 0.067, 'neu': 0.698, 'pos': 0.235, 'compound': 0.6486}"
66,2019-04-26,14:53:47+0000,Just 17 states require high school students to complete a personal finance course. But more states may soon join them.,"{'neg': 0.0, 'neu': 0.891, 'pos': 0.109, 'compound': 0.296}"
67,2019-04-27,09:00:09+0000,"Mr. Sanders’s campaign kicked off its national organizing program Saturday with what it says are roughly 5,000 events across every state.","{'neg': 0.0, 'neu': 1.0, 'pos': 0.0, 'compound': 0.0}"
68,2019-04-26,20:57:56+0000,"Mr. Buttigieg will now refuse contributions from federal lobbyists and will return $30,250 to 39 individuals, his campaign said.","{'neg': 0.109, 'neu': 0.891, 'pos': 0.0, 'compound': -0.296}"
69,2019-04-26,18:31:29+0000,"Mr. Biden raised more in his first 24 hours than any other candidate, easing concerns among some supporters over his ability to raise money.","{'neg': 0.0, 'neu': 0.745, 'pos': 0.255, 'compound': 0.7351}"
70,2019-04-26,20:07:22+0000,"Philanthropic experts said they were not shocked by what seemed like an ungrateful response to the money raised to restore the cathedral, but few agreed on a solution.","{'neg': 0.06, 'neu': 0.628, 'pos': 0.312, 'compound': 0.7529}"
71,2019-04-25,09:03:24+0000,Deutsche Bank and Commerzbank said the risks outweighed the benefits of trying to create a mega-bank capable of taking on Wall Street giants.,"{'neg': 0.077, 'neu': 0.657, 'pos': 0.266, 'compound': 0.6369}"
72,2019-04-25,20:47:32+0000,The case was the last remaining government lawsuit against the bank over financial crisis-era issues.,"{'neg': 0.119, 'neu': 0.881, 'pos': 0.0, 'compound': -0.2263}"
73,2019-04-23,12:00:06+0000,"Mr. Biden, ahead in the polls but behind financially, is seeking out top money bundlers, but that risks a backlash among grass-roots Democrats.","{'neg': 0.107, 'neu': 0.805, 'pos': 0.089, 'compound': -0.1154}"
74,2019-04-20,09:00:07+0000,"Interviews with several dozen Democrats show how the party, which enjoyed 2018 victories powered by female and nonwhite candidates, is grappling with questions about race and gender in the Trump era.","{'neg': 0.0, 'neu': 0.829, 'pos': 0.171, 'compound': 0.7184}"
75,2019-04-19,19:28:32+0000,"Major Democratic donors in Pennsylvania and California are soliciting big checks for Joe Biden, who is expected to launch his 2020 campaign next week.","{'neg': 0.0, 'neu': 1.0, 'pos': 0.0, 'compound': 0.0}"
76,2019-04-19,09:00:12+0000,"A proposed deal is meeting resistance from labor, regulators and some shareholders. But there is also political momentum in Germany for a tie-up.","{'neg': 0.0, 'neu': 1.0, 'pos': 0.0, 'compound': 0.0}"
77,2019-04-19,14:21:31+0000,"Schools are not required to use the same terminology in their offers. And an “award” could mean a grant — or a loan. “Celebrate,” one expert says. “Then, decide.”","{'neg': 0.0, 'neu': 0.909, 'pos': 0.091, 'compound': 0.3612}"
78,2019-04-19,19:17:36+0000,"Divorce negotiations are never easy, and they became more complicated this year, thanks to the tax overhaul. Here are four tips for taxpayers to consider.","{'neg': 0.085, 'neu': 0.813, 'pos': 0.102, 'compound': 0.1265}"
79,2019-04-17,23:14:12+0000,The Trump administration cut off the central bank’s access to United States currency and limited its ability to conduct international financial transactions.,"{'neg': 0.148, 'neu': 0.664, 'pos': 0.188, 'compound': 0.2732}"
80,2019-04-17,22:10:44+0000,"JPMorgan gave more responsibilities to Marianne Lake and Jennifer Piepszak, making both top contenders to eventually succeed its chief executive, Jamie Dimon.","{'neg': 0.0, 'neu': 0.8, 'pos': 0.2, 'compound': 0.6124}"
81,2019-04-17,20:10:17+0000,"In business, in a relationship or in any big project, you have to focus here before you focus there.","{'neg': 0.0, 'neu': 1.0, 'pos': 0.0, 'compound': 0.0}"
82,2019-04-17,09:00:11+0000,“The Lehman Trilogy” is a theatrical panorama of the firm’s history and collapse. Lehman descendants and onetime employees have taken a keen interest.,"{'neg': 0.12, 'neu': 0.674, 'pos': 0.206, 'compound': 0.3182}"
83,2019-04-17,02:21:23+0000,"New figures suggest the Chinese slowdown is bottoming out. Credit goes to a wave of lending, but economists warn that debt-fueled growth can’t continue.","{'neg': 0.06, 'neu': 0.746, 'pos': 0.194, 'compound': 0.5574}"
84,2019-04-17,00:16:44+0000,"Senator Elizabeth Warren has spent millions to build her campaign staff, while Mayor Pete Buttigieg spent less than 10 percent of what he raised in the first quarter.","{'neg': 0.0, 'neu': 1.0, 'pos': 0.0, 'compound': 0.0}"
85,2019-04-16,15:29:41+0000,Bernie Sanders is the money leader. Elizabeth Warren is spending big. Pete Buttigieg emerged out of nowhere. And (almost) everyone is buying gobs of Facebook ads.,"{'neg': 0.0, 'neu': 1.0, 'pos': 0.0, 'compound': 0.0}"
86,2019-04-15,21:39:40+0000,"Presidential campaigns were required to disclose their finances for the first quarter of the year by Monday night, a key moment in the early days of the race.","{'neg': 0.0, 'neu': 1.0, 'pos': 0.0, 'compound': 0.0}"
87,2019-04-15,22:13:52+0000,Subpoenas from the House’s Financial Services and Intelligence committees were the latest attempts by congressional Democrats to collect information about the finances of President Trump.,"{'neg': 0.0, 'neu': 0.886, 'pos': 0.114, 'compound': 0.4767}"
88,2019-04-15,19:37:55+0000,"With so many start-ups listing their shares this year, each is trying to avoid the traffic jam to get its own moment in the sun.","{'neg': 0.08, 'neu': 0.839, 'pos': 0.08, 'compound': 0.0}"
89,2019-04-15,00:11:21+0000,Mr. Trump’s haul is about the size of what Senators Bernie Sanders and Kamala Harris — the top two Democratic fund-raisers — raised combined in the first quarter.,"{'neg': 0.0, 'neu': 0.933, 'pos': 0.067, 'compound': 0.2023}"
90,2019-04-14,17:03:58+0000,"The total for Ms. Gillibrand, announced after many rivals disclosed their numbers, trails the amounts raised by the other five senators currently running for president.","{'neg': 0.0, 'neu': 1.0, 'pos': 0.0, 'compound': 0.0}"
91,2019-04-14,18:10:16+0000,"Fewer taxpayers have received refunds so far this year, and refunds are smaller. Now is the time to check your paycheck withholdings.","{'neg': 0.0, 'neu': 1.0, 'pos': 0.0, 'compound': 0.0}"
92,2019-04-12,17:44:05+0000,"JPMorgan Chase and PNC Financial Services Group reported growth in the first quarter, despite a federal government shutdown that lasted for most of January.","{'neg': 0.0, 'neu': 0.894, 'pos': 0.106, 'compound': 0.3818}"
93,2019-04-12,16:27:14+0000,"Liability waivers, often in small type and filled with legal verbiage, have become a part of modern life. But how enforceable are they?","{'neg': 0.077, 'neu': 0.858, 'pos': 0.064, 'compound': -0.0772}"
94,2019-04-12,14:20:22+0000,"The Social Security Administration used to mail out many more statements each year. Now, it encourages workers to go online. A new report says millions haven’t looked.","{'neg': 0.0, 'neu': 0.819, 'pos': 0.181, 'compound': 0.6486}"
95,2019-04-11,10:13:44+0000,"The chiefs of seven huge American banks testified on Capitol Hill yesterday, and talked regulation, Russia, recession and more.","{'neg': 0.127, 'neu': 0.769, 'pos': 0.104, 'compound': -0.128}"
96,2019-04-10,18:25:20+0000,"Amid political turmoil, a blueprint by President Recep Tayyip Erdogan’s government avoids the tougher steps economists say are needed to reverse a recession.","{'neg': 0.272, 'neu': 0.661, 'pos': 0.066, 'compound': -0.6486}"
97,2019-04-10,14:00:32+0000,"Ms. Warren’s total lagged what several other Democratic presidential candidates received in the first quarter of the year, but she had a strong finish to the quarter.","{'neg': 0.053, 'neu': 0.799, 'pos': 0.148, 'compound': 0.5927}"
98,2019-04-10,18:00:45+0000,A simple rule that bolsters the banking system — “know your customer” — could help combat fake news and hate speech online if companies like Facebook and Twitter embraced it.,"{'neg': 0.253, 'neu': 0.604, 'pos': 0.143, 'compound': -0.6124}"
99,2019-04-09,14:07:31+0000,"A day before he was to testify before Congress, the chief executive, Brian Moynihan, said the lowest-paid workers would earn $17 an hour starting in May and $20 in two years.","{'neg': 0.0, 'neu': 1.0, 'pos': 0.0, 'compound': 0.0}"
100,2019-04-08,20:48:51+0000,"The senator’s fund-raising total includes an undisclosed amount that she could spend only in a general election campaign, not in the primary.","{'neg': 0.0, 'neu': 1.0, 'pos': 0.0, 'compound': 0.0}"
101,2019-04-07,17:51:50+0000,"Mr. Booker’s total is among the smallest fund-raising figures to be voluntarily disclosed so far, though it is expected to outpace others who have not yet announced.","{'neg': 0.0, 'neu': 1.0, 'pos': 0.0, 'compound': 0.0}"
102,2019-04-05,21:34:58+0000,"Mr. Malpass, a Wall Street veteran and a Treasury official, is a longtime critic of the international agency’s lending practices and business model.","{'neg': 0.096, 'neu': 0.822, 'pos': 0.082, 'compound': -0.0772}"
103,2019-04-06,10:00:04+0000,"Once known for prudence, Danske Bank and Swedbank are at the vortex of multifaceted money laundering scandals. Here’s how to make sense of them.","{'neg': 0.122, 'neu': 0.878, 'pos': 0.0, 'compound': -0.4939}"
104,2019-04-05,13:00:05+0000,"Mark Begor thinks Equifax can be the consumer-friendly credit bureau. So where are our free credit reports, automatic credit freezes for babies and consistent straight talk?","{'neg': 0.032, 'neu': 0.587, 'pos': 0.381, 'compound': 0.8979}"
