,date,time,abstract,sentiment_score
751,2019-07-09,07:00:05+0000,"The world’s monetary authorities have limited policy space, and it’s unclear whether their backup plans will suffice to bolster growth and inflation.","{'neg': 0.153, 'neu': 0.745, 'pos': 0.102, 'compound': -0.0772}"
752,2019-07-08,09:14:36+0000,"Turkey remains stuck in perilous proximity to economic crisis, as households and businesses defer spending and investment in the face of weak growth.","{'neg': 0.352, 'neu': 0.566, 'pos': 0.082, 'compound': -0.8225}"
753,2019-07-07,15:10:23+0000,"The bank that once symbolized German economic prowess is effectively abandoning hope of playing in the same league as Wall Street banks, and struggling to remain relevant.","{'neg': 0.154, 'neu': 0.629, 'pos': 0.217, 'compound': 0.296}"
754,2019-07-06,18:25:57+0000,The move by Recep Tayyip Erdogan dealt a new blow to the central bank’s credibility while threatening to intensify the nation’s wrenching economic crisis.,"{'neg': 0.263, 'neu': 0.737, 'pos': 0.0, 'compound': -0.8176}"
755,2019-07-06,09:00:12+0000,"Kamala Harris gets a bump after the debates, Pete Buttigieg raises $24.8 million and Cory Booker unveils an immigration overhaul.","{'neg': 0.0, 'neu': 1.0, 'pos': 0.0, 'compound': 0.0}"
756,2019-07-05,17:43:56+0000,"Ms. Harris’s total for the quarter, which went from April through June, is far below what some other first-tier candidates reported this week.","{'neg': 0.0, 'neu': 1.0, 'pos': 0.0, 'compound': 0.0}"
757,2019-07-05,09:54:02+0000,"The embattled German lender’s board is expected to vote as soon as Sunday on an extensive turnaround plan that could lead to 20,000 layoffs.","{'neg': 0.0, 'neu': 1.0, 'pos': 0.0, 'compound': 0.0}"
758,2019-07-05,13:15:47+0000,There are ways to get help: Start by contacting your card companies to ask about an interest-rate cut or lower minimum.,"{'neg': 0.172, 'neu': 0.72, 'pos': 0.108, 'compound': -0.1531}"
759,2019-07-03,16:15:40+0000,"Mr. Biden’s fund-raising haul fell short of Pete Buttigieg’s total for the second quarter of the year, though Mr. Biden did not enter the race until late April.","{'neg': 0.0, 'neu': 1.0, 'pos': 0.0, 'compound': 0.0}"
760,2019-07-02,22:07:02+0000,"Christine Lagarde will become one of the most powerful figures in international finance, giving her a leading hand in the world’s second largest economy.","{'neg': 0.0, 'neu': 0.697, 'pos': 0.303, 'compound': 0.8268}"
761,2019-07-03,23:04:43+0000,"Judy Shelton, President Trump’s nominee to the Federal Reserve Board, criticizes how the central bank sets rates — and could reignite an old controversy.","{'neg': 0.098, 'neu': 0.902, 'pos': 0.0, 'compound': -0.34}"
762,2019-07-02,14:14:04+0000,"Mr. Sanders’s fund-raising has slowed since he began his campaign, though his second-quarter total is still likely to be among the largest in the field.","{'neg': 0.0, 'neu': 1.0, 'pos': 0.0, 'compound': 0.0}"
763,2019-07-01,09:47:07+0000,Mr. Buttigieg’s $24.8 million second-quarter total is the latest evidence that he has gone from a long shot to a serious candidate for the nomination in a matter of months.,"{'neg': 0.047, 'neu': 0.912, 'pos': 0.04, 'compound': -0.0516}"
764,2019-10-20,19:57:46+0000,Ms. Warren had been criticized for sidestepping questions about whether she would raise taxes on the middle class to help finance “Medicare for all.”,"{'neg': 0.092, 'neu': 0.809, 'pos': 0.099, 'compound': 0.0516}"
765,2019-11-07,17:00:43+0000,The case is the first in France to have led to a criminal inquiry into a company’s liability for its activities abroad.,"{'neg': 0.224, 'neu': 0.776, 'pos': 0.0, 'compound': -0.6369}"
766,2019-08-27,19:03:08+0000,Atalaya Capital Management agreed to pay restitution to more than 100 New York residents for its financial support of Vision Property Management.,"{'neg': 0.053, 'neu': 0.687, 'pos': 0.26, 'compound': 0.6597}"
767,2019-07-14,19:08:39+0000,"The island territory is preparing to present its complete restructuring plan for its $124 billion debt. Court challenges are almost certain, but if the plan survives it could be a road map for troubled states.","{'neg': 0.15, 'neu': 0.783, 'pos': 0.067, 'compound': -0.6365}"
768,2019-10-13,23:42:20+0000,"One would effectively hand control of the business to SoftBank of Japan, its top shareholder, and another would raise billions in debt via JPMorgan Chase.","{'neg': 0.08, 'neu': 0.669, 'pos': 0.252, 'compound': 0.6597}"
769,2019-08-27,13:00:06+0000,"As demand grows and climate-change restrictions raise costs, developers are flocking to PACE financing for relief.","{'neg': 0.081, 'neu': 0.753, 'pos': 0.167, 'compound': 0.3818}"
770,2019-07-03,11:26:23+0000,"The raid was linked to an investigation into Carlos Ghosn, the automaker’s former chairman and chief executive.","{'neg': 0.0, 'neu': 1.0, 'pos': 0.0, 'compound': 0.0}"
771,2019-08-01,20:21:10+0000,The lawsuit contends that Vision Property Management puts profits over people by putting hopeful home buyers into houses that often are uninhabitable.,"{'neg': 0.068, 'neu': 0.641, 'pos': 0.292, 'compound': 0.743}"
772,2019-10-16,02:56:19+0000,Twelve Democratic presidential candidates shared the stage in Ohio for the fourth televised primary debate.,"{'neg': 0.0, 'neu': 0.854, 'pos': 0.146, 'compound': 0.34}"
773,2019-07-12,07:00:07+0000,The proposed levies on firms like Facebook and Google are pitting traditional allies against one another and threatening to set off a cascade of tax increases and tariffs.,"{'neg': 0.11, 'neu': 0.809, 'pos': 0.081, 'compound': -0.2263}"
774,2019-10-30,16:59:15+0000,The deal will not grant Mr. Low special treatment in the criminal case against him involving a looted Malaysian fund.,"{'neg': 0.22, 'neu': 0.599, 'pos': 0.18, 'compound': -0.2491}"
775,2019-11-12,14:00:10+0000,"Women are pushing to establish more senior roles for themselves in commercial real estate, an area where they are severely underrepresented.","{'neg': 0.13, 'neu': 0.87, 'pos': 0.0, 'compound': -0.4588}"
776,2019-10-16,00:32:02+0000,Mayor Buttigieg said Senator Warren  had not been forthcoming about whether she would raise taxes on the middle class to help finance a health care plan.,"{'neg': 0.0, 'neu': 0.796, 'pos': 0.204, 'compound': 0.7096}"
777,2019-08-16,10:51:01+0000,"Mines are closing, and middlemen are being squeezed. But don’t expect bargains at the jewelry counter.","{'neg': 0.0, 'neu': 1.0, 'pos': 0.0, 'compound': 0.0}"
778,2019-07-11,11:52:57+0000,"The French Senate voted to impose a tax on Facebook, Google and other American technology companies despite a blunt warning from the Trump administration.","{'neg': 0.091, 'neu': 0.825, 'pos': 0.084, 'compound': -0.0423}"
779,2019-07-01,15:43:31+0000,Businesses had plenty of reasons to worry in the first half — from slowing economic growth to geopolitical tensions — but they looked beyond those factors to strike big deals at a record pace.,"{'neg': 0.162, 'neu': 0.786, 'pos': 0.052, 'compound': -0.4118}"
780,2019-09-11,07:01:26+0000,"The American imports spared by Beijing include lubricants, pesticides and cancer drugs but not the major agricultural products that Washington considers crucial to making a trade deal.","{'neg': 0.097, 'neu': 0.903, 'pos': 0.0, 'compound': -0.4019}"
781,2019-07-18,09:54:53+0000,Revived trade negotiations between the U.S. and China are said to be stuck as officials debate how much Washington should ease up on the company.,"{'neg': 0.073, 'neu': 0.836, 'pos': 0.091, 'compound': 0.128}"
782,2019-11-07,20:30:36+0000,The Ohio factory will be taken over by a venture that plans to hire 400 employees next year to make electric pickup trucks.,"{'neg': 0.0, 'neu': 1.0, 'pos': 0.0, 'compound': 0.0}"
783,2019-07-18,09:54:53+0000,Revived trade negotiations between the U.S. and China are said to be stuck as officials debate how much Washington should ease up on the company.,"{'neg': 0.073, 'neu': 0.836, 'pos': 0.091, 'compound': 0.128}"
784,2019-11-11,11:51:07+0000,"The entrepreneur is shifting his message, hiring more experienced political hands and spending big as he tries to expand his support in early states. (And yes, he expected to make it this far.)","{'neg': 0.0, 'neu': 0.796, 'pos': 0.204, 'compound': 0.7717}"
785,2019-10-30,20:42:55+0000,"The company said its profit dropped 3.1 percent from a year ago, but there are early hints that new iPhones are selling well heading into the holidays.","{'neg': 0.0, 'neu': 0.742, 'pos': 0.258, 'compound': 0.7906}"
786,2019-09-24,11:27:07+0000,The decision to make the automaker repay taxes saved in a deal with Luxembourg offers clues about a similar case against Apple.,"{'neg': 0.0, 'neu': 0.872, 'pos': 0.128, 'compound': 0.4215}"
787,2019-11-15,16:00:13+0000,Ms. Warren laid out a blueprint to pass major health legislation at the start of her presidency. But she would wait as long as three years to seek passage of a full-scale “Medicare for all” plan.,"{'neg': 0.0, 'neu': 1.0, 'pos': 0.0, 'compound': 0.0}"
788,2019-08-12,08:02:19+0000,The oil giant’s chief financial officer said the timing of a public listing would depend on its “shareholder”: Saudi Arabia’s government.,"{'neg': 0.0, 'neu': 1.0, 'pos': 0.0, 'compound': 0.0}"
789,2019-09-12,12:00:07+0000,"In her latest proposal to redistribute wealth in the United States, Ms. Warren calls for raising taxes on the rich to expand Social Security benefits.","{'neg': 0.0, 'neu': 0.529, 'pos': 0.471, 'compound': 0.9423}"
790,2019-11-15,14:00:06+0000,"We keep stumbling across examples of discrimination in algorithms, but that’s far better than their remaining hidden.","{'neg': 0.0, 'neu': 0.806, 'pos': 0.194, 'compound': 0.5927}"
791,2019-08-26,19:36:20+0000,"As the long bull market shows signs of fatigue, some industry analysts are starting to ask: What will become of all the upstart brands when the economy sours?","{'neg': 0.069, 'neu': 0.931, 'pos': 0.0, 'compound': -0.25}"
792,2019-11-18,12:54:19+0000,"Fresh off a multibillion-dollar loss on WeWork, SoftBank plans to shore up its domestic business with a big bet on Japan’s leading messaging app company.","{'neg': 0.09, 'neu': 0.82, 'pos': 0.09, 'compound': 0.0}"
793,2019-11-15,14:00:06+0000,"We keep stumbling across examples of discrimination in algorithms, but that’s far better than their remaining hidden.","{'neg': 0.0, 'neu': 0.806, 'pos': 0.194, 'compound': 0.5927}"
794,2019-11-18,12:54:19+0000,"Fresh off a multibillion-dollar loss on WeWork, SoftBank plans to shore up its domestic business with a big bet on Japan’s leading messaging app company.","{'neg': 0.09, 'neu': 0.82, 'pos': 0.09, 'compound': 0.0}"
795,2019-09-05,02:25:12+0000,CNN hosted 10 Democratic presidential candidates as they discussed their plans for tackling global warming.,"{'neg': 0.0, 'neu': 0.897, 'pos': 0.103, 'compound': 0.1531}"
796,2019-08-31,11:00:09+0000,Opportunity zones were created as part of the Trump tax law to lure investment to distressed areas. But much of the money is fueling real-estate developments targeting the affluent.,"{'neg': 0.083, 'neu': 0.774, 'pos': 0.143, 'compound': 0.25}"
797,2019-08-15,09:54:16+0000,"The world economy is under increasing stress as growth cools and trade tensions take a mounting toll. Yesterday, that became painfully apparent.","{'neg': 0.312, 'neu': 0.596, 'pos': 0.091, 'compound': -0.743}"
798,2019-07-17,03:00:09+0000,"A San Francisco company financed by Mr. Musk, Neuralink says it has created a device that could one day wire data links directly to the brain.","{'neg': 0.0, 'neu': 0.92, 'pos': 0.08, 'compound': 0.25}"
799,2019-10-26,14:59:37+0000,"After college, he joined the firm that would become Drexel Burnham Lambert.","{'neg': 0.0, 'neu': 1.0, 'pos': 0.0, 'compound': 0.0}"
800,2019-10-24,22:13:35+0000,"The $5 billion development in the Meadowlands, formerly known as Xanadu and now called American Dream, will open on Friday. Sort of.","{'neg': 0.0, 'neu': 0.913, 'pos': 0.087, 'compound': 0.25}"
801,2019-10-16,01:19:54+0000,"Beto O’Rourke took aim at Elizabeth Warren, who wants to create an annual tax on the accumulated wealth of the richest Americans.","{'neg': 0.0, 'neu': 0.686, 'pos': 0.314, 'compound': 0.8271}"
802,2019-09-21,04:01:12+0000,"The country once had the world’s fastest-growing economy, but it has been battered by global and domestic forces. India’s troubles are a warning sign for other developing countries.","{'neg': 0.221, 'neu': 0.779, 'pos': 0.0, 'compound': -0.7964}"
803,2019-08-08,00:51:41+0000,"Mr. Wexner, the retail mogul behind Victoria’s Secret, gave a detailed account in a letter of how his life became intertwined with Mr. Epstein, his former money manager.","{'neg': 0.0, 'neu': 1.0, 'pos': 0.0, 'compound': 0.0}"
804,2019-08-05,22:28:03+0000,"Walmart, the country’s largest retailer and seller of guns, should use its vast economic leverage to force corporate America to confront shooting deaths.","{'neg': 0.072, 'neu': 0.928, 'pos': 0.0, 'compound': -0.1779}"
805,2019-10-14,09:56:43+0000,"Three professors, Abhijit Banerjee and Esther Duflo, both of M.I.T., and Michael Kremer of Harvard, were honored.","{'neg': 0.0, 'neu': 0.808, 'pos': 0.192, 'compound': 0.5859}"
806,2019-07-12,12:00:05+0000,A deal announced Friday is an example of how carmakers are joining forces to survive a major shift in technology. But can two longtime rivals cooperate?,"{'neg': 0.0, 'neu': 1.0, 'pos': 0.0, 'compound': 0.0}"
807,2019-09-17,09:40:09+0000,The company’s parent has been trying to rescue the public offering amid concerns about the high valuation for a business that is deeply unprofitable.,"{'neg': 0.0, 'neu': 0.87, 'pos': 0.13, 'compound': 0.5106}"
808,2019-07-30,20:30:06+0000,"Revenue rose slightly in the most recent quarter, the company said, but profits still fell as iPhone sales continued to drop.","{'neg': 0.104, 'neu': 0.745, 'pos': 0.151, 'compound': 0.296}"
809,2019-08-07,01:14:41+0000,"A retailer synonymous with cutting-edge fashion, Barneys New York built its reputation by luring shoppers with unconventional methods.","{'neg': 0.0, 'neu': 1.0, 'pos': 0.0, 'compound': 0.0}"
810,2019-08-05,05:23:46+0000,Democratic presidential candidates denounced a culture of hatred and white nationalism that some said emanated from the Trump White House after two mass shootings.,"{'neg': 0.16, 'neu': 0.84, 'pos': 0.0, 'compound': -0.6369}"
811,2019-07-02,16:24:10+0000,The United States moved to impose levies on more products than previously planned in an escalation of its fight with Europe over government aid for Boeing and Airbus.,"{'neg': 0.147, 'neu': 0.767, 'pos': 0.086, 'compound': -0.25}"
812,2019-07-22,10:06:03+0000,The steady flow of money that China once poured into the U.S. has shrunk since President Trump took office.,"{'neg': 0.0, 'neu': 1.0, 'pos': 0.0, 'compound': 0.0}"
813,2019-11-11,22:18:40+0000,"Days after Michael Bloomberg began taking steps to enter the 2020 race, Mr. Patrick’s conversations with top Democrats are the latest evidence of an unsettled presidential primary field.","{'neg': 0.076, 'neu': 0.864, 'pos': 0.06, 'compound': -0.128}"
814,2019-08-06,04:00:34+0000,"The retailer plans to close 15 of its 22 locations and pursue a sale, but said its flagship Madison Avenue store would remain open.","{'neg': 0.0, 'neu': 0.932, 'pos': 0.068, 'compound': 0.1531}"
815,2019-10-31,22:29:52+0000,The Treasury Department says the Obama-era regulations are unnecessary after the 2017 tax overhaul.,"{'neg': 0.0, 'neu': 0.878, 'pos': 0.122, 'compound': 0.2023}"
816,2019-10-11,09:51:27+0000,Thierry Bolloré was dismissed after Nissan named a new chief. The automakers are part of an alliance once led by the ousted Carlos Ghosn.,"{'neg': 0.0, 'neu': 1.0, 'pos': 0.0, 'compound': 0.0}"
817,2019-07-31,19:14:18+0000,"Mr. Epstein, the accused sex trafficker, was fascinated by eugenics. He told scientists and others of his vision of using his New Mexico ranch to impregnate women.","{'neg': 0.07, 'neu': 0.767, 'pos': 0.163, 'compound': 0.4404}"
818,2019-09-24,11:30:07+0000,Mr. Sanders is embracing an idea at the center of Elizabeth Warren’s presidential campaign. His proposal goes further in who would be taxed and how much money would be raised.,"{'neg': 0.0, 'neu': 1.0, 'pos': 0.0, 'compound': 0.0}"
819,2019-08-18,18:12:31+0000,The authorities have begun to raise alarms about a steady uptick in the number of militant groups using the hard-to-trace digital currency.,"{'neg': 0.094, 'neu': 0.848, 'pos': 0.058, 'compound': -0.2023}"
820,2019-08-14,12:16:19+0000,Clashes at one of the world’s busiest transportation hubs could cast further doubt on the city’s future as a business capital on China’s doorstep.,"{'neg': 0.102, 'neu': 0.898, 'pos': 0.0, 'compound': -0.3612}"
821,2019-10-21,17:43:16+0000,Executives fanned out in Washington to court lawmakers and regulators. Mark Zuckerberg is expected to testify about Libra this week before the House.,"{'neg': 0.0, 'neu': 1.0, 'pos': 0.0, 'compound': 0.0}"
822,2019-10-08,00:01:52+0000,"As the utility defends its bankruptcy plan against a challenge from bondholders and wildfire victims, its liabilities are still being calculated.","{'neg': 0.183, 'neu': 0.759, 'pos': 0.058, 'compound': -0.4215}"
823,2019-08-14,12:16:19+0000,Clashes at one of the world’s busiest transportation hubs could cast further doubt on the city’s future as a business capital on China’s doorstep.,"{'neg': 0.102, 'neu': 0.898, 'pos': 0.0, 'compound': -0.3612}"
824,2019-11-07,10:00:16+0000,The movement to reinterpret or change antimonopoly laws is running headlong into a legal community and interest groups just as invested in defending the status quo.,"{'neg': 0.0, 'neu': 0.836, 'pos': 0.164, 'compound': 0.5423}"
825,2019-07-30,13:00:06+0000,"More developers are confronting a host of financial, operational and public relations challenges in their efforts to rebuild.","{'neg': 0.103, 'neu': 0.826, 'pos': 0.072, 'compound': -0.144}"
826,2019-10-15,20:32:05+0000,"Far more than at the previous Democratic debates, President Trump will be a major factor in the discussion, scrambling the candidates’ calculations about what to say onstage.","{'neg': 0.0, 'neu': 1.0, 'pos': 0.0, 'compound': 0.0}"
827,2019-07-17,10:21:27+0000,Lawmakers had strong questions and criticism for tech giants yesterday during three hearings on Capitol Hill. Here’s what happened.,"{'neg': 0.125, 'neu': 0.733, 'pos': 0.142, 'compound': 0.1027}"
828,2019-09-17,13:00:09+0000,New York is seeking to replace the discount-clothing stores and doughnut chains that line its subway corridors with trendy food halls and upscale shops.,"{'neg': 0.0, 'neu': 1.0, 'pos': 0.0, 'compound': 0.0}"
829,2019-08-12,23:31:06+0000,"After mass shootings jolted the nation this month, the Democratic candidates seemed to move in lock step toward more aggressive gun control positions without resistance from moderates.","{'neg': 0.155, 'neu': 0.845, 'pos': 0.0, 'compound': -0.5531}"
830,2019-10-31,10:01:22+0000,Fiat Chrysler and the parent company of Peugeot announced this morning that they have agreed to merge.,"{'neg': 0.0, 'neu': 0.884, 'pos': 0.116, 'compound': 0.2732}"
831,2019-07-26,10:26:58+0000,Chris Hughes helped create the social network. Now he’s working with academics and government regulators on arguments for dismantling the company.,"{'neg': 0.113, 'neu': 0.798, 'pos': 0.088, 'compound': -0.1531}"
832,2019-09-29,12:00:04+0000,The social network says it has struggled to get the information to researchers because it also wants to protect its users’ privacy.,"{'neg': 0.096, 'neu': 0.8, 'pos': 0.104, 'compound': 0.0516}"
833,2019-09-17,13:00:09+0000,New York is seeking to replace the discount-clothing stores and doughnut chains that line its subway corridors with trendy food halls and upscale shops.,"{'neg': 0.0, 'neu': 1.0, 'pos': 0.0, 'compound': 0.0}"
834,2019-09-19,21:27:47+0000,"Known for its quiet and steady growth, Stripe said on Thursday that it received new funding that made it worth $35 billion.","{'neg': 0.0, 'neu': 0.816, 'pos': 0.184, 'compound': 0.5423}"
835,2019-08-20,21:07:09+0000,The president said he thought he could bypass Congress to index capital gains to inflation.,"{'neg': 0.0, 'neu': 0.854, 'pos': 0.146, 'compound': 0.34}"
836,2019-08-09,13:46:39+0000,Political chaos and confrontation with the European Union over spending rules have reinforced what a finance professor calls the country’s “serial stagnation.”,"{'neg': 0.24, 'neu': 0.76, 'pos': 0.0, 'compound': -0.7184}"
837,2019-08-01,09:00:11+0000,"After splitting from Universal, Brian Grazer and Ron Howard, who started Imagine Entertainment in 1986, find themselves making content for a host of streaming services.","{'neg': 0.0, 'neu': 0.891, 'pos': 0.109, 'compound': 0.4215}"
838,2019-10-13,18:32:19+0000,An unmistakable sense of alarm is spreading among both small business owners and corporate executives who see no way out of the impasse.,"{'neg': 0.18, 'neu': 0.82, 'pos': 0.0, 'compound': -0.5574}"
839,2019-08-09,10:08:19+0000,"The accusations, related to work with the scandal-plagued 1MDB fund, raise legal and reputational challenges for the powerful Wall Street bank.","{'neg': 0.092, 'neu': 0.683, 'pos': 0.225, 'compound': 0.3182}"
840,2019-08-12,10:27:24+0000,"The financier’s apparent suicide has prompted more questions about his alleged crimes and how they will be dealt with, not least over what will happen to his estate.","{'neg': 0.143, 'neu': 0.857, 'pos': 0.0, 'compound': -0.6705}"
841,2019-07-09,23:02:13+0000,"The arrest of the financier reopened old wounds in the world of magazine journalism, with the writer Vicky Ward accusing the editor Graydon Carter of having toned down an article.","{'neg': 0.128, 'neu': 0.872, 'pos': 0.0, 'compound': -0.4767}"
842,2019-10-09,18:10:46+0000,Minutes of the central bank’s September meeting show growing worries about the trade war and global growth.,"{'neg': 0.279, 'neu': 0.542, 'pos': 0.179, 'compound': -0.5267}"
843,2019-08-12,10:27:24+0000,"The financier’s apparent suicide has prompted more questions about his alleged crimes and how they will be dealt with, not least over what will happen to his estate.","{'neg': 0.143, 'neu': 0.857, 'pos': 0.0, 'compound': -0.6705}"
844,2019-08-29,09:00:09+0000,"The needs of older relatives remove women from the labor force in the United States far more than in other wealthy nations, at a cost to the economy.","{'neg': 0.0, 'neu': 0.825, 'pos': 0.175, 'compound': 0.6486}"
845,2019-10-08,01:20:24+0000,"Regulatory concerns would have made a deal difficult. Still, both exchanges and their home cities face difficult questions about their future.","{'neg': 0.217, 'neu': 0.783, 'pos': 0.0, 'compound': -0.6124}"
846,2019-11-02,09:00:15+0000,"Ms. White, a Florida televangelist, is being brought into the Trump administration to help shore up his evangelical base — even though some Christians consider her beliefs heretical.","{'neg': 0.0, 'neu': 0.903, 'pos': 0.097, 'compound': 0.4019}"
847,2019-08-28,21:55:09+0000,"The takeover of a venerable department store is an opportunity, its buyer says, to expand its rental offerings — and a sign of retail’s seismic shifts.","{'neg': 0.0, 'neu': 0.805, 'pos': 0.195, 'compound': 0.6249}"
848,2019-08-12,21:23:50+0000,"Seeking new markets, the Arab kingdom plans to buy 20 percent of the oil-related businesses of India’s biggest company, Reliance Industries.","{'neg': 0.0, 'neu': 1.0, 'pos': 0.0, 'compound': 0.0}"
849,2019-10-02,19:42:45+0000,The fashion and lifestyle site had something that Vice lacked: an audience made up largely of women.,"{'neg': 0.0, 'neu': 1.0, 'pos': 0.0, 'compound': 0.0}"
850,2019-11-18,20:33:47+0000,Prime Minister Boris Johnson and Jeremy Corbyn made efforts to dispel past impressions in speeches to Britain’s largest industry group.,"{'neg': 0.0, 'neu': 0.909, 'pos': 0.091, 'compound': 0.2263}"
851,2019-10-16,17:04:59+0000,The streaming giant regained some footing after losing U.S. subscribers this year. But new rivals will make it tough for that growth to continue.,"{'neg': 0.148, 'neu': 0.758, 'pos': 0.094, 'compound': -0.128}"
852,2019-10-24,20:56:13+0000,"After ending the third quarter with less cash than four rivals, Joe Biden’s campaign reversed course to stop discouraging supporters from forming a super PAC to help him in the Democratic primary.","{'neg': 0.126, 'neu': 0.64, 'pos': 0.234, 'compound': 0.6597}"
853,2019-11-17,10:00:10+0000,Health care had not been a driving issue for the Massachusetts senator. But the expansive $20.5 trillion package could come to define her candidacy anyway.,"{'neg': 0.0, 'neu': 0.878, 'pos': 0.122, 'compound': 0.4939}"
854,2019-10-16,17:04:59+0000,The streaming giant regained some footing after losing U.S. subscribers this year. But new rivals will make it tough for that growth to continue.,"{'neg': 0.148, 'neu': 0.758, 'pos': 0.094, 'compound': -0.128}"
855,2019-11-11,18:35:22+0000,The troubled office space company is said to be considering several candidates for the top job after pushing out its founder.,"{'neg': 0.126, 'neu': 0.798, 'pos': 0.076, 'compound': -0.296}"
856,2019-07-11,19:33:55+0000,The use of L.L.C.s and shell corporations to hide the true source of funds has been an issue for the United States for more than a decade. A bill in Congress seeks to address it.,"{'neg': 0.046, 'neu': 0.804, 'pos': 0.15, 'compound': 0.5994}"
857,2019-09-03,23:59:18+0000,"Doug McMillon, Walmart’s chief executive, said the company would stop selling certain types of guns and ammunition. This should be an example for corporate America.","{'neg': 0.081, 'neu': 0.842, 'pos': 0.077, 'compound': -0.0258}"
858,2019-07-11,20:03:59+0000,"Federal lawyers previously advised the commission to block the company, Area 1, from providing services to presidential candidates at a discount.","{'neg': 0.132, 'neu': 0.868, 'pos': 0.0, 'compound': -0.4404}"
